year	rank	votes	artist	song	filename	source	lyrics	language
1994	1		Ummamuudu	Kõnõtraat	lyrics-ummamuudu-konotraat	1	:,:Välän külmetas ja taivast satas lummõ. Ütle mullõ uma telefoninummõr.:,: :,:Hamõ õhukõ, su sälän prunts om tummõ. Ütle mullõ uma telefoninummõr.:,: :,:Hammõst läbi paistus rõnnakõnõ kummõr. Ütle mullõ uma telefoninummõr.:,: :,:Sis meil tulõva Fiesta ja Rock Summõr. Utle mullõ uma telefoninummõr.:,: :,:Sis ku kulmetas ja välän satas lummõ, utle mullõ uma telefoninummõr.:,:	et
1994	2		Vennaskond	Pille-Riin	lyrics-vennaskond-pille-riin	1	Taevas sinetav ja hämar, kuhugi on kadund kuu. Sulalumine on tänav, akna all on raagus puu. Lume sisse pikad triibud, teinud Sinu Soome kelk. Nukralt seljatoele liibud, silmis äraolev helk. Pille-Riin, Pille-Riin, kohtume me täna siin, õhtusinas laternate all. Pille-Riin, Pille-Riin, lapsepõlv on möödas siin, varakevadisel tänaval. Sul on suvepäike põues, kevadõhtu on Su vend. Soovin, et siinsamas õues, riietaksid lahti end. Päästad mantli hõlmad valla, kleidinööbid lahti eest. Tulvaveega rentslist alla, häbelikkus kaob Su seest. Pille-Riin, Pille-Riin, kohtume me täna siin, õhtusinas laternate all. Pille-Riin, Pille-Riin, lapsepõlv on möödas siin, varakevadisel tänaval. Seisad lumes, nagu loodi, tead, et tahan tulla ma. Sinu tuppa, Sinu voodi, Sinuga koos hullama. Tänasest on saanud eile, triibulisse patja pead surume, ja tundub meile, inimesed kõik on head. Pille-Riin, Pille-Riin, kohtume me täna siin, õhtusinas laternate all. Pille-Riin, Pille-Riin, lapsepõlv on möödas siin, varakevadisel tänaval. Hommikuses päikses aga, sinisilmad lahti teed. Kuulatad, kuis akna taga, rõõmsalt vulisevad veed. Ära mulle silma tüki, päikene, va pudrusilm. Läbi väikse klaasitüki roheline näib maailm. Pille-Riin, Pille-Riin, kohtume me täna siin, õhtusinas laternate all. Pille-Riin, Pille-Riin, lapsepõlv on möödas siin, varakevadisel tänaval.	et
1994	3		Jam	See 5	lyrics-jam-see_viis	1	See viis haaras mind, see viis võlus mind, see viis võitis mind kui esmakordselt kuulsin laulmas sind. Sind nägin päiksena lavalt paistmas, sind terve saalitäis mõttes mõistmas, su laulu lõhna ja mõtet haistmas ainult ma ei mõistnud sind. Ka mina püüdsin sust aru saada, ei tahtnud teistest ma maha jääda, kuid laulu mõte läks minust mööda, ainult viisi jagas pea. See viis haaras mind… Võib-olla laulsid sa armurõõmust, võib-olla väikesest veinisõõmust, võib-olla ühtegi mõttejäänust selles laulus polnud sees. Kui puuga oleks ma pähe saanud, ei ühtki sõna mul meelde jäänud, kuid sellest viisist ei küllalt saanud, - sina ise olid viis! See viis haaras mind… Nüüd olen aastaid su kõrval käinud, su häid ja halbugi külgi näinud, ei ole siiski sust aru saanud, kõrvus ainult mul see viis. Su publikuks nüüd on toatäis lapsi, kes kuulavad sind nii vastutahtmist, ei ole roose, ei suurt aplausi, jäänud ainult on see viis. See viis haaras mind…	et
1994	4		The Tuberkuloited	Lilleke Rohus	lyrics-the_tuberkuloited-lilleke_rohus	1	Tüdruk vaatab lille, lill kasvab rohus ja tüdrukul meeldib see lilleke rohus Tüdruk vaatab lille, mina tüdrukut rohus ja minule meeldib see lilleke rohus Chorus: Lilleke rohus, lilleke rohus lilleke rohus, aaaa... Lilleke rohus, lilleke rohus lilleke rohus, aaaa... Tüdruk vaatab lille, ei märka, et ohus on tema ja maailm ja lilleke rohus Tüdruk vaatab lille, ei lill kasva rohus ja miskit ei taipa ses tohuvabohus Chorus (2x) Tüdruk vaatab lille, lill kasvab rohus on tema ja maailm, on tema ja maailm on tema ja maailm ja lilleke rohus Chorus	et
1994	5		The Tuberkuloited	Põhjamaa Neid	lyrics-the_tuberkuloited-pohjamaa_neid	1	Kui käes on hommik ja süttib taevas ja päev saab valget valgust täis, aaaa... Siis öö on möödas, siis öö on möödas mu põhjamaa neid Siis öö on möödas, siis öö on möödas mu põhjamaa neid Kuu helgib taevas ja kuldsed kiired neist maha varjud jätavad, aaaa... Su õrnad huuled, su õrnad huuled mu põhjamaa neid Su õrnad huuled, su õrnad huuled mu põhjamaa neid Siin on nii hämar, siin on nii vaikne vaid sinu sosistusi kuulen, aaaa... Ja näen su nägu, su valget nägu mu põhjamaa neid Ja näen su nägu, su valget nägu mu põhjamaa neid Ma usun vaikust, ja usun õrnust ja olen sinuga siin koos, aaaa... Sa oled ilus, sa oled ilus mu põhjamaa neid Sa oled ilus, sa oled ilus mu põhjamaa neid Su vaim haihtub, sus süttib valgus sind ootan tagasi mu neid, aaaa... siis oled ilus, siis oled ilus mu põhjamaa neid siis oled ilus, siis oled ilus mu põhjamaa neid Kui käes on hommik ja süttib taevas ja päev saab valget valgust täis, aaaa... Siis öö on möödas, siis öö on möödas mu põhjamaa neid Siis öö on möödas, siis öö on möödas mu põhjamaa neid....	et
1994	6		Jam	Su Järele Igatsen Ma	lyrics-jam-su_jarele_igatsen_ma	1	Enne sind ei teadnud ma kuis võis olla see nii, et pilgust võisin armuda, nii võõras tundus see siis. Kas mäletad neid arge pilke, mil esmalt nägid mind Sa rõõmust valla lasid kilke, kui tantsule palusin sind Ref:Kas sa ei tea mu südamesoovi Kas tõesti ei tunne end sa Et mul hing kannab armuloori Su järele igatsen ma Nii äkki kui sind kohtasin, sinust ilma samas ma jäin Ma mõtlematult petsin sind ja me teineteist enam ei näind. Kuid lootust kaotanud ma pole pikkamisi ootan sind Tean, et tagasi sa tuled ootusest tuksumas mu rind. Ref:Kas sa ei tea mu südamesoovi Kas tõesti ei tunne end sa Et mul hing kannab armuloori Su järele igatsen ma. (5x)	et
1994	7		2 Quick Start	Olen Loobuda Sust Proovinud	lyrics-2_quick_start-olen_loobuda_sust_proovinud	1	"1. PÕHJUST MILJON, MILLEST MÕELDA VÕIN, NÄEN SU NÄOST, EI AITA SEE. SÕRMUS KAASA VIIS MU SOOVID KÕIK, KÄEL SU SOOJUST TUNNEN VEEL. Ref: OLEN LOOBUDA SUST PROOVINUD, SEE NÄIB LOOTUSETU SOOV. SINUST LEIDSIN KÕIK, EI HOOLIND MUUST, IGAVIK NÜÜD VAID RAHU TOOB. 2. MA EI JÄÄNUD ÜKSI EKSLEMA, VÕÕRAS MUL ON SÜÜTA SÜÜ. LIND SU ARMUPUURIS PEKSLEMAS, MA OLIN SIIS JA OLEN NÜÜD. Ref:	OLEN LOOBUDA… Ref:	OLEN LOOBUDA…"	et
1994	8		Terminaator	Torm	lyrics-terminaator-torm	1	Olen tulnud liiga pikalt teelt Tühja maja leidsin enda eest Ja silmanurgas pisar läigatas Ja sahtlipõhjast sinu pildi leian ma Ja seda ainiti jään vaatama Mälestused tolmust puhtaks pühin ma Ei suuda elada ma ilma sinuta Siis palun.. Lase mind sisse külma tormi eest Võta mind soojade käte vahele Nii ma ukselävel palusin Kuid sina ukse sulgesid Mu maja sinuta nii tühi näib Ma nagu vaim toast tuppa ringi käin Ja õhtul kui ma vaarun voodisse Ja õhtul kui ma mõtlen jälle sinule Siis palun.. Lase mind sisse külma tormi eest Võta mind soojade käte vahele Nii ma ukselävel palusin Lase mind sisse külma tormi eest Võta mind soojade käte vahele Nii ma ukselävel palusin Kuid sina ukse sulgesid Lase mind sisse külma tormi eest Võta mind soojade käte vahele Nii ma ukselävel palusin	et
1994	9		2 Quick Start	Sinu Jaoks	lyrics-2_quick_start-sinu_jaoks	1	1. EKSISIN OTSIDES SIND MÖÖDA PATUSEID TEID, KUID EI LEIDNUD. ARMASTUST OOTAS MU HING, TÜDIND NEIST, KEDA KÄED SENI HOIDNUD. MINU ELLU TÕI SIND JUHUS VAID, SAATUS HAAVAND OLI MÕLEMAID. OLLA TAHAN NÜÜD- SINU JAOKS. 2. SUUDLUSE MAHLANE MAIK AINA MEENUTAB SIND MINU HUULIL. ÕHTUNE KOHTUMISPAIK ÕNNEHETKI NÄEB TAAS VÄIKSEID, SUURI. VAREM KÕIK, MIS NÕNDA ARGLIK NÄIS, SOOVE MEELETUMAID NÜÜD ON TÄIS. TUHAKS PÕLEND MAID- SINU JAOKS. 3. NÜÜD, MIL MU KÕRVAL SA KÄID JA MIND ARMASTAD NII, KUI EIKEEGI. TUNDUB, ET MAHA MEIST JÄI, SEE MIS SURMATA VÕIS ARMULEEGI. ÄRA IIAL SULE UST MU EEST, KUI PEAN ÜKSI JÄÄMA KAOTAN TEE. KALLIS HOIA END- MINU JAOKS.	et
1994	10		D-Gän	Seib	lyrics-d-gan-seib	1	ELASID KOOS KORD MUTTER JA POLT EI SEGANUD NEID IIAL MITTE ÜKS TONT SÜNDIS NEIL POEG SAI SEIB NIMEKS TAL KÕIK OLI KENA SIIN PÄIKESE ALL KUID ÜKSKORD POLT VÄIKSED ÕLLED SEES KÜSIS MIKS POLE SEIBIL VINTE SEES MUTTER EI OSANUD VASTATA JA JÄIGI VASTUS SAAMATA SEIB! (SEIB) ON POLDI POEG (ON POLDI POEG) MUTRI JA POLDI POEG (SEIB) VINDINE POLT (POLDI POEG) SEIB! (SEIB) ON POLDI POEG (ON POLDI POEG) POLDIPOEG - MUTTER VA SORT ELASID KOOS KORD MUTTER JA POLT EI SEGANUD NEID IIAL MITTE ÜKS TONT SÜNDIS NEIL POEG SAI SEIB NIMEKS TAL KÕIK OLI KENA SIIN PÄIKESE ALL KUID ÜKSKORD POLT VÄIKSED ÕLLED SEES KÜSIS MIKS POLE SEIBIL VINTE SEES MUTTER EI OSANUD VASTATA JA JÄIGI VASTUS SAAMATA SEIB! (SEIB) ON POLDI POEG (ON POLDI POEG) MUTRI JA POLDI POEG (SEIB) VINDINE POLT (POLDI POEG) SEIB! (SEIB) ON POLDI POEG (ON POLDI POEG) POLDIPOEG - MUTTER VA SORT SELLEST HETKEST HAKKAS SEIBIL VILTU VEDAMA EMA ISA TEDA LÕID (TEDA LÕID) KUNI SEIBIL MEEL NII MUSTAKS LÄKS KUI MUSTIKAS JA ENNAST TÄIS TA JÕI - JÕI ENNAST TÄIS (JÕI TÄIS) KUID SIIS ROOSTEUSS HAKKAS TEDA NÄRIMA SUURED PLEKID SISSE SÕI (SISSE SÕI) SÕI NIIKAUA KUNI SEIB ROOSTEST KÄRINAL JA ENNAST TÄIS TA JÕI - JÕI ENNAST TÄIS (JÕI TÄIS) ELASID KOOS NII MUTTER JA SEIB OLI SEIBILE TEKKIND ÜKS RISTPEAGA BEIB TAHTSID SIIS NAD ABIELLUDA KUID LINNAS PUUDUS KRUVIKEERAJA ELU LÄKS IKKAGI EDASI ELASID SÕID JA MAGASID POLNUD JU TEHA NEIL MIDAGI JA POLNUD TEHA VAJAGI SOLUNN ON SOLUNNI POEG	et
1994	11		Vennaskond	Disko	lyrics-vennaskond-disko	1	Me läbime ööd ja teel, mille algust ei mäleta enam ja meid ei huvita ammu mis on me siht ja muud peale kiiruse, punase auto ei ole meil midagi enam. Tumesinine taevas ja tähed. Müürina mööduvad puud. 'Anna üks sigaret,'-'Võta.' Rohkem ei tarvita sõnu. 'Ava üks pudel,'-'Jah, kohe.' Sellega lõppeb me jutt. Muusika mängib ja kuskilt on tuttav see tunne ja valu. Mälestus.Igatsus. Ammu on lõppenud ahastav nutt. Siiski ei ole meil aega, kuigi ei ole ka kiiret jõuda kuhugi välja - parem ma vastan:'Ei tea.' Sõita kusagilt välja - selleks ei ole meil julgust. Asfaldi valged jooned. Kiirteede viimased read. Avada järgmine pudel, süüdata järgmine suits. Konid ja tühi taara, klaasikillud me teel jäävad meist tänagi maha. Muusika mängib ja saadab meid, meie jälgedes sõitjaid ja neid, kes sõitsid me ees...	et
1994	12		2 Quick Start	Neiu Mustas Kleidis	lyrics-2_quick_start-neiu_mustas_kleidis	1	On tähine taevas, mustavas öös on sündimisvaevas roos, mis lahti lööb end armunu peos, kes otse tabatud teolt. On trummi ja tamburiinide hääl. Roos avab end mustas kleidis neiu käes, kes, jalgades tuul, mind kutsub, naeratus suul. (Ref.) Neiu mustas kleidis, tantsi veel, tantsi veel! Neiu mustas kleidis... Neiu mustas kleidis, tantsi veel, tantsi veel! Neiu mustas kleidis... Kui rahuneb rütm ja trummide hääl ma tantsival neiul haaran kinni käest, kuid pudeneb koost meid öösel sidunud roos. (Ref.) (Ref.)	et
1994	13		Nancy	Mul luba loota	""			
1994	14		Mr. Lawrence	Every Day Is Like Sunday	lyrics-mr_lawrence-everyday_is_like_sunday	1	Trudging slowly over wet sand Back to the bench where your clothes were stolen This is the coastal town That they forgot to close down Armageddon - come armageddon! Come, armageddon! come! Everyday is like sunday Everyday is silent and grey Hide on the promenade Etch a postcard : How I dearly wish I was not here In the seaside town ...that they forgot to bomb Come, come, come - nuclear bomb Everyday is like sunday Everyday is silent and grey Trudging back over pebbles and sand And a strange dust lands on your hands (and on your face...) (on your face ...) (on your face ...) (on your face ...) Everyday is like sunday Win yourself a cheap tray Share some greased tea with me Everyday is silent and grey	en
1994	15		2 Quick Start	Kingitus	lyrics-2_quick_start-kingitus	1	Olles käsi käes, käime öises linnas. Vaateaknail näen kaupa kõrges hinnas Järsku peatud sa, teatad särasilmil, et ma varsti saan hinnalise kingi Tea,et iial, muud ei soovi ma, mu kingitus oled sa. Kui mu kaenlas, ehteks on su käed, mu kallimaks kingiks jääd. Minu kingiks jääd. Minu kingiks jääd, mu kallimaks kingiks jääd. Mind sa naerad veel, küllap peagi märkad, mulle tähtis see, kui mu kõrval ärkad Tea,et iial, muud ei soovi ma, mu kingitus oled sa. Kui mu kaenlas, ehteks on su käed, mu kallimaks kingiks jääd. Tea,et iial, muud ei soovi ma, mu kingitus oled sa. Kui mu kaenlaas, ehteks on su käed, mu kallimaks kingis jääd. Minu kingiks jääd, minu kingiks jääd. Mu kallimaks kingiks jääd. Jeee-jeee-jeee-jeee 5x Tea,et iial, muud ei soovi ma, mu kingitus oled sa. Kui mu kaenlas, ehteks on mu käed, mu kallimaks kingiks jääd Minu kingiks jääd, minu kingiks jääd.Mu kallimaks kingiks jääd.	et
1994	16		Kuldne Trio	Ütlen Sulle A	""			
1994	17		2 Quick Start	Kaksikud	lyrics-2_quick_start-kaksikud	1	"Silmade värv ja kulmukaar Naeratus kui peeglis Ühtmoodi kleit ja kingapaar kumb on kumb,ei tea. Üks ütleb \""ei\"" siis teine \""ja\ ei tee vahet keegi. Nii leidsin neid ja korraga nüüd käingi kahe neiuga. Ref: On see kaotus, on see võit? Kord kui tuleb ilmsiks kõik Ei siis andeks anna keegi. On see kaotus, on see võit? Kord kui tuleb ilmsiks kõik Kauneid kaksikuid on veelgi. Miks mulle küll ei ütle vaist, kummast kinni hoida. Ühtaegu kaasaks kahte naist võtta ju ei saa. Kord tuleb üks, siis teine neist armurõõme leidma Ühte kui suudlen, ihkan teist ei tea, mis peab nii saama neist. Ref: On see kaotus, on see võit? Kord kui tuleb ilmsiks kõik Ei siis andeks anna keegi. On see kaotus, on see võit? Kord kui tuleb ilmsiks kõik Kauneid kaksikuid on veelgi."	et
1994	18		Jam	Tants Mida Tantsime	lyrics-jam-tants_mida_tantsisime	1	Mis paneb Sind küll arvama, Et oled mulle ainus Sa. Miks peaksin Sind ma taluma? Miks mitte rahus elada. Leia endale kallim uus, Kellele Sa oled truu. Miks pillud Sa kauneid sõnu, Kui isegi neisse ei usu. Tants mida tantsisime, Ei kordu kunagi. Laul mida laulsime... Ei kõla enam iialgi. Tants mida tantsisime, Ei kordu kunagi. Laul mida laulsime... Ei kõla enam iialgi. Ära arva et kurvastan. Ma oma kodus nüüd üksinda. Ja et ei unista ma muust, Kui ainult sinu meelast suust Mind endale ei võida Sa Ka oma naeratusega Vajan elult ma midagi uut Las kingib sulle rõõmu keegi muu Tants mida tantsisime, Ei kordu kunagi. Laul mida laulsime... Ei kõla enam iialgi. Tants mida tantsisime, Ei kordu kunagi. Laul mida laulsime... Ei kõla enam iialgi. Tants mida tantsisime, Ei kordu kunagi. Laul mida laulsime... Ei kõla enam iialgi. Tants mida tantsisime, Ei kordu kunagi. Laul mida laulsime... Ei kõla enam iialgi.	et
1994	19		Vennaskond	Nüüd Mingem Siit Veel Koidu Eel	lyrics-vennaskond-nuud_mingem_siit_veel_koidu_eel_	1	Nüüd mingem siit, veel koidu eel, on udused, külmad mäed me teel. Kuid kaugemal, ürgkalju all me võlukuld meid ootab veel. Seal muiste päkapikusool käis sügaval koopais igal pool, kus päev või öö, virk sepatöö ning nõidust appi võitis hool. Sai kuningas neilt aardeid häid, mis kuldselt sädelema jäid. Nad ehteid lõid, mis valgust tõid ja pärgi, kirevaid mõõgapäid. Ning suutis mõnigi meistermees, et tähti õitses hõbekees. Ja kroon nii kuldset pildus tuld, seal kuu ja päike särasid sees. Nüüd mingem siit, veel koidu eel, on udused, külmad mäed me teel. Kuid kaugemal, ürgkalju all me unund kuld on alles veel. Ka kauneid peekreid tehti seal ja kullast kandleid, keeled peal. Ei leidnud viis neilt kuuljaid siis, kus inime maad ei kaeva eal. Lõi künkal mühama männitukk, öös tuulte oigeis kostis hukk. Lõõsk oksi sõi, lõõm laotust lõi, leek ropsis puil kui punane kukk. All orus kumises häirekell, kõik rahvas vaatas, hirmus hell, kuis lohe raev, oh õud ja vaev, seal möllas majadel, tornidel. Mäel tossas suits, mis hukke rikk nüüd pageda paistis ainulik. Mäest lahkus hõim, jäi maole võim, sai surma mõnigi päkapikk. Nüüd mingem kähku, kõigest väest, ning üle mitmest süngest mäest, kus udud maas, et võita taas me kuld ja kandled lohe käest.	et
1994	20		Kuldne Trio	Ulla-Tralla	""			
1994	21		Mr. Lawrence	Moonchild	lyrics-mr_lawrence-moonchild	1	Trembling to the beat of late October wind dressed in dusty rags You've been thinking all those years Like a golden autumn leaf that's trying to set its spirit free You've been hiding all those tears Just keep the frequency clear waiting for Your alien friend It makes me wonder is there anybody up there to hear Your lonely cry Twin to my heart You're watching the sky dreaming of this yellow land And when You get there don't you forget to give my regards to the moonchild... Naked children out of breath following the traces in the snow You've been running from those fears Catching signals getting hope recieving trust are we supposed to believe in what we hear?	en
1994	22		Jam	Miks Minema Läed?	lyrics-jam-miks_minema_laed	1	Kui sind kohtasin,ei teadnud kas see on ilmsi,siis lootsin ma, et seekord jääd sa. Ma õnnest joobusin,sinu heaks kõigest loobusin. Arvasin,et õnn on see, kui petlik oli see Ref;Miks taas kord sa siia ei jää? Ütle,miks veelkord sa minema läed, minema läed. Miks soovid sa jälle lahkuda? Oo,kas sa ei tea,et mulle kuulud sa. Kas sul on keegi veel,kes ootamas sind tee peal ees. Ikka loodan ma, et tagasi tuled sa	et
1994	23		Beep Shop Boys	Kuul	lyrics-beep_shop_boys-kuul	1	Kallis nääri... jõulmees Palun too mulle... Kätte jõudmas aasta uus Kõigil pastakas on suus Paberile kirja read Tempel, mark kõik nii kuis peab Päkapikud kirja saavad üli väga tigedad nad Miks nii hila kulla mees Otsa meil said BMW'd Nukud, suusad, supikulp Pardel, kell ja higipulk Teflonpann ei ole hea kui riiulilt ta tabab pead Kõiks saab kotti, kõik mis passib Vana laiali kõik tassib Aga miks küll tasuta Aru päkapikk ei saa [x4] la-la-lalla, la-la-lalla la-la-lall, la-la-lall la-la-lalla Kõik on rõõmsad, kõik on head Rasvarida rinna peal Küünlasäras heledas President on telekas Kõlab kaksteist kella pauku Šhampus kaob kui muti auku Vastu taevast käib saluut Kosmonautki naerab kuul cool, cool Kosmonaut on kuul, kuul Päkapikk on kuul, kuul Kingitus on kuul, kuul Kõik on kuul, kuul Kõik on kuul, kuul Kosmonaut on kuul, kuul Vanagi on kuul, kuul Kuul, kuul Kõik on kuul, kuul	et
1994	24		Allan Roosileht	Turvamees	lyrics-allan_roosileht-turvamees	1	Oma lahkeid taevasiniseid silmi pean ma varjama mustade päikseprillide taha Mitte, et ma midagi kardaks, vaid et mind õigesti mõistetaks Päike on erakordselt ere Minu elu möödub rahulikult ja turvaliselt Vahel tuleb tundide kaupa mõne prominendi või vasevaguni kõrval seista. Harva õhtupimeduses võib end vabamalt tunda ja mõnele napsutanud tulinorijale pasunassse anda Kuid selle kõige juures tuleb jääda soliidseks, vaoshoituks, rahulikuks Sest mina olengi... Turvamees Vabaduse puiesteelt Pisikese maja ees seisab BMW Turvamees - must ülikond ja lips on ees, Raha eest teeb tegusid mees Ühel õhtul veeres väravasse päratu must Ameerika limusiin Uks avanes ja sellest libisesid tavasillutisele kõrgetel kontsadel päevitanud pikad sääred Peagi seisis auto kõrval silmipimestavalt kaunis miniseelikus blondiin Siis kõlas esimene lask Tulistati avatud autoaknast Algas lahing, katsin pea kätega, järsku kõik vaibus Minu kõrval seisis mingi mees, Tõstsin silmad, loojuva päikese helk pimestas, Kuid ma tundsin oma ammuse rivaali ära See oli... Turvamees Linnakivi puiesteelt Viiekordse maja ees seisab Citroen Turvaemees - must ülikond ja lips on ees Raha eest teeb tegusid mees Hull aeg nõuab segaseid inimesi Meie palatis on 2 kuningat, keiser, 3 peaministrit, mõned presidendid ja üks kindral Piimasupi lauas mõtlen käeraudadele, mis ma karusmarja põõsa alla maasse kaevasin Oma eelnevast elust ei tule paljutki enam meelde, Kuid ma tunnen, et ühel heal paeval kaevan ma väärt instrumendi välja Südames on mingi eriline aimus, justkui mind oleks tagasi valitud Oleksin justkui... Turvamees Vabaduse puiesteelt Pisikese maja ees seisab BMW Turvamees - must ülikond ja lips on ees, Raha eest teeb tegusid mees naa na naa daa daa daa .. dadadada dadada Turvamees	et
1994	25		D.J. X & Vello Orumets	Miniseelik	lyrics-vello_orumets-miniseelik	1	Oi miniseelik, mini-mini seelik. Oi ülemeelik tänapäeva mood. On nooruslik, on justkui koolieelik, sellepärast südames nii kummalised lood Nii kaua Annest külmalt mööda läksin, ent küll ta on mind püüdnud võluda. Ning alles eile kõik see muutus äkki, kui uues kleidis tööle tuli ta. Oi miniseelik, mini-mini seelik. Oi ülemeelik tänapäeva mood. On nooruslik, on justkui koolieelik, sellepärast südames nii kummalised lood Ma käisin korda kolm ta laua juures ja pidin korda kolm ma ohkama. Ta üllatusest tegi silmad suured, kui kutsusin ta õhtuks kohtama. Oi miniseelik, mini-mini seelik. Oi ülemeelik tänapäeva mood. On nooruslik, on justkui koolieelik, sellepärast südames nii kummalised lood	et
1994	26		Pearu Paulus ja Evelin Samuel	Kallim Kullast	lyrics-2_quick_start-_kallim_kullast	1	Ei julge öelda ma mil kinkida saan sul marmorist palee hinnalist pärlikeed soovida on lootusetu veel Tead ju su embuses ma uinun vaid sinu suudlus päikse toob hinges on suurim soov kõikjal olla koos mu armas Küllaga kulda kusagil ootab leidmata jääda võib see ei tea, mis ootab ees armastus meile kullast on kallim veel Tead ju, et see mis ees meid ootab kord pole rooside allee olgu kui raskel teel hea on minna koos mu armas Chorus: Küllaga kulda kusagil ootab leidmata jääda võib see ei tea, mis ootab ees armastus meile kõigest on kallim Küllaga kulda kusagil ootab leidmata jääda võib see ei tea, mis ootab ees armastus meile kullast on kallim veel Chorus	et
1994	27		Evelin Samuel	Vari Ja Roos	""			
1994	28		Jam	Petlik On Õnn	lyrics-jam-petlik_onn	1	Kus oled nüüd sa, mis sinust on saand? Ühine tee, mida mööda sai käidud, tolmuks on saand. Kas näha sind saan kunagi veel? Rõõm ja õnn, mis meile said osaks, petlikuks jäid. Ükskõik, kuhu läen või mida ma teen, sinu nägu ja silmi nii rõõmsaid oma kujutlusis näen. Sa oled nii hea, nii lahke ja hell, sest sinu hingesoojust vajab süda nii habras ja hell. Mida vajan ma veel, kallis, kas sind kohtan eluteel? Sa oled nii noor, minu lootus ja õnn. Ma tahaksin olla su juures ja aidata sind. Olid ainus mul sa, sinust mõtlen nüüd ma. Kas oli see õige, et äkki mu juurest ära läksid sa? Mida vajan ma veel, kallis, läksid lahku meie teed. Kus oled nüüd sa, mis sinust on saand? Ühine tee, mida mööda sai käidud, tolmuks on saand. Nii petlik on õnn, nii petlik on õnn. Rõõm ja õnn, mis meile said osaks, petlikuks jäid. Nii petlik on õnn ...	et
1994	29		Jam	Öised Teed	""			
1994	30		Jam	Ootan Tuult	lyrics-jam-ootan_tuult	1	Ootan tuult, olen laev, kes on eksinud teelt vale suund Ootan tuult, kes ehk rääkida oskab mu keelt on mul tuul Ootan tuul Ootan tuult, olen laev, kes on eksinud teelt vale suund Ootan tuult, kes ehk rääkida oskab mu keelt on mul tuul Pole viita teel, mille suunda ma oma samme nüüd aina seaks Ainult tuul vastab hüüdele ääretul veel tardunud Tuule häält aina kuulan ja kuulama pean iga päev Pole kõrvu mul kõigiks juttudeks Kõrkushuultele pett on neid Mu sõbraks vaid tuul, ootan tuult Üks küsimus suul, mul vastab tuul Ma usaldan tuult, mil vaibub tuul Ma kuulen ta häält Ootan tuult ... Pole kõrvu mul ... Mu sõbraks vaid ...	et
1994	31		Beep Shop Boys	Hakkaböö	lyrics-beep_shop_boys-hakaboo	1	[x3]Kuusi tuleb Kui lõppemas on ära järjekordne päev Hakaböö, hakaböö, Hakkab-hakkab-hakkab öö Kuu siis tuleb, kuu siis tuleb Kuu siis tuleb taevasse ja särab nagu juust Hakkab tantsupidu vali Kõlab lust ja naer ja nali Kõikjal palju noori koos [x3]Mõnu-mõmu-mõnu tantsuhoos ai-ai ämmale ma luban, et ei korduks vanad vembud Mõnus sälg, kena jalg Mõnus jah, kena palg Anna andeks kallis Uuno Ma pold täna sinu tald Sorri vaan, sorri vaan, küll sa kuskilt ikka saad Täna tantsib hoopis minuga üks turske afrikaan Afrikaan, na na naan, Täna neegri mina saan Neeger tantsib nagu loom pärast kohvi mulle toob Lõbusama tuju loob Sukamütsi talle koon Higi haiseb Pidu Ega Uunogi ei jää ilma Mitu totsi jäävad silma Täitsa pohhui kellga Veeta mõus tantsu öö Enim meeldib siiski vist üks Mongoolia turist Neiu kellel nimeks Nellikim Ja kellel suured tissid Kissis silmad, Kiss my lips Mongo väga mõnus tips Lahe liha tantsu kütkes Soundi tuleb, action käib Paremat mis veel võib tahta Tantsida on pappa-pappa Kõigil naeratus on suul purr-purr-pruu teeb kõhutuul Vastik	et
1994	32		Kuldne Trio	Vana roosa	""			
1994	33		Tõnis Mägi	Püha Elmo tuled	lyrics-tonis_magi-puha_elmo_tuled	1	Kes korjas sõnad sinu suult koidutuul räsis pilvevaipa ma seisin, hammustades huult kus sa jäid - ma ei taipa Ma sinu sünnimärke tean veresooni ja tedretäppe kas kõik nad siis unustama pean sest ei saa sind ma kätte Kui armastad, siis armasta kuid olen pannud tähele et virvatuli väreleb ning eal ei lähene, ei eal Jutt hõbe on, vaikimine kuld laevamastil või kellatornis kus märkad sa püha Elmo tuld kodutee leiad siis tormis :,: Kui armastad, siis armasta kuid olen pannud tähele et virvatuli väreleb ning eal ei lähene, ei eal ta lähene :,: Kui märkad püha Elmo tuld siis kodutee ees seisab ju sul Kui armastad, siis armasta kuid jäägu meie vahele et leek mis jääb sust järele see eal ei jahene, ei eal ta jahene	et
