year	rank	votes	artist	song	filename	source	lyrics	language
2001	15	249	Terminaator	See ei ole saladus 	lyrics-terminaator-see_ei_ole_saladus	1	Langes tähti tol öösel kui me istusime vana lagunenud maja kivitrepile minu lõhkised teksad sinu jääkülmad käed see on muinasjutt tüdruk küll sa ükskord seda näed Tahtsin öelda nii palju siiski vaikisin vaid sõnu vaja ei olnud minust aru sa said vana lagunenud maja tuulest kolksatas uks sellest hetkest mu süda jäigi sulle avatuks See ei ole saladus et olime siin taskunoaga meie nimed seina lõikasin vana maja juurde viis meid rohtunud tee see oli koht kus lõpuks üksteist leidsime Sinu silmis tol öösel oli kutse ja soov sinu jaoks see öö vist oli nagu julguseproov juuksed langesid näole silmad sulgesid sa seda hetke ma luban et ei iial unusta See ei ole saladus et olime siin taskunoaga meie nimed seina lõikasin vana maja juurde viis meid rohtunud tee see oli koht kus lõpuks üksteist leidsime Kui hommik saabub minema sa pead mind leiad siit sa tead	et
2001	16	245	Nele-Liis Vaiksoo & Jassi Žahharov	Öölaps 	lyrics-nele-liis_vaiksoo-oolaps	1	(Oota vaid) Vahel keset ööd ma tunnen korraga kurbust ja on nukker mu meel. (Oota vaid) Mõnel vaiksel ööl ma näen nii lummavat und, kuid siis kui üles ärkan keelab mind hirm. (Oota vaid) Mõnel vaiksel ööl ma aina igatsen, ootan ja sel hetkel äkki haarab mind õud. (Oota vaid) Mõnel vaiksel ööl mind sünge pimedus lummab nii, et vastu panna puudub mul jõud. (Oota vaid, öölaps) Kuulen kauget häält, mis kutsub mind. (Oota vaid, öölaps) Kuulen kauget häält, mis kutsub mind. Vabaks saab vaid loobudes, kui sa hülgad maise pinna. Ja märkad peagi joobudes, et sa maksid õige hinna. Hellalt kokku meid sulatab öö, taevas Linnutee vöö. Meid kannab üle tähtede ja kahtlused viib. Meid valguse eest kaitsvat varju kannab mu tiib. Sa oled hele täht, mis vaid öös võib hiilata. Mu südame kui säraküünla süütasid sa. Sind/Mind ootab ees elu pikk, sellest ööst algab uus igavik, sellest ööst algab kõik/igavik. Kartsin kord, et südame ma kaotada võin, nüüd vist kaotan mõistuse ka. All tundemeri lai ja kuskilt ei paistagi maad. Kartsin kord, et armastus lööb segi mu pea, nüüd on segi kõik minu sees. Kuuvarjutus on see, kui maa seisab päikese ees. (Oota vaid) Mõnel külmal ööl näib nii, et põgenema pean su eest veel kuni suudan ma. (Oota vaid) Siis, kui kutsud mind, ma olen valmis kõike jätma olgu kas või põrgutuli me siht. (Oota vaid) Mõnel vaiksel ööl ma näen, et tähti taevas süütab hingeleek, mis särab silmades sul. (Oota vaid) Mõnel kaunil ööl ma annaks ära oma elu selle eest, et sind näeks koidikul. (Oota vaid, öölaps) Kuulen kauget häält, mis kutsub mind. (Oota vaid, öölaps) Igatsusest jalge alt kaob pind. Vabaks saad vaid loobudes, kui sa hülgad maise pinna. Ja märkad peagi joobudes, et sa maksid õige hinna. Hellalt kokku meid sulatab öö, taevas Linnutee vöö. Meid kannab üle tähtede ja kahtlused viib. Meid valguse eest kaitsvat varju kannab su tiib. Sa oled hele täht, mis vaid öös võib hiilata. Mu südame kui säraküünla süütasid sa. Sind/mind ootab ees elu pikk, sellest ööst algab uus igavik, sellest ööst algab kõik/igavik. Kartsin kord, et südame ma kaotada võin, nüüd siis kaotan mõistuse ka. All tundemeri lai ja kuskilt ei paistagi maa. Kartsin kord, et armastus lööb segi mu pea, nüüd on segi kõik sinu sees. Kuuvarjutus on see, kui maa seisab päikese ees. All tundemeri lai ja kuskilt ei paistagi maa. Kuuvarjutus on see, kui varjata tundeid ei saa.	et
2001	17	189	Terminaator	Portselanist tüdruk 	lyrics-terminaator-portselanist_tudruk	1	Kui ma olin väike poiss mu ema ütles nii püüa kinni tulilind ja tähtedeni vii anna endast parim ela näe ja armasta kuid iial ära tegemist tee portselaniga Sest portselanist tüdrukut ei ole mõtet suudelda portselanist tüdrukut võib ainult kaugelt vaadata sest portselan see puruneda võib nii kergesti ja portselanist tüdruk sind ei suudle iial tagasi Kui sain vanemaks mu isa mulle seletas palju kauneid naisi liigub ringi maailmas ole see kes oled savõid teha mida teed kuid portselanist hoia oma näpud eemale Sest portselanist tüdrukut ei ole mõtet suudelda portselanist tüdrukut võib ainult kaugelt vaadata sest portselan see puruneda võib nii kergesti ja portselanist tüdruk sind ei suudle iial tagasi Aastad veerevad kui kivid mis ei sammaldu kui sind kohtasin mu peast lendas välja kõik muu minu käte vahel lõpuks purunesid sa ja portselan mu hinge lõikas haava sügava Sest portselanist tüdrukut ei ole mõtet suudelda portselanist tüdrukut võib ainult kaugelt vaadata sest portselan see puruneda võib nii kergesti ja portselanist tüdruk sind ei suudle iial tagasi	et
2001	18	178	Droopy & G-Enka	Tallinn 	lyrics-droopy_g-enka_vs_dj_critikal-tallinn	1	Nüüd väike bluus, Tallinna elust kus mida juhtub ja mida saab kust ja sa teed püksi, siin agulis üksi kerget pääsu ära siit sa otsi sellepärast Droopy räpib täna nii et riim jõuaks kõlarist rullnokani Jõmm...Tallinnast teinud oled pasapealinna kuid nüüd käia teab ka sinna see pole Palermo, Sitsiilia ta on ega NSV vaid BMW mis Hollywoodi ees ekskursioone teeb tere tulemast põrgu,Tallinnale alõkk, almõkk, McDonalds üheskoos Vitali Popov ja saepuru Joonas on koomas Tallinna iidne kultuur linna tuum rahvuselt on subkultuur su juur ei olegi nii suur, vot nii arvan nii, sest olen kosmopoliit ähmis ja pahane, napsis ja joogine Genkaga nüüd röögime, Toompealt alla öögime ah see pole veel lõpp, rivijutt jätab mulje nagu Droopy olex tropp hip-hop sellex toodud, et sigadustel tuleks lõpp muidu Vana-Toomast asendab rullnokk Chorus: Karmim kraam on Tallinnas rikkad nutavad Tallinnas tervetuloa Tallinna siin pakume kloorivett tühi koht on maailmas Tallinn asub all-ilmas arva mida ma pean silmas tooge meile palun joogivett Kui siia ilma sündisin jala maha panin Tallinnas siin olen kodus nii Toompeal kui all-ilmas Põhja-Tallinn, lõuna, kirre, ida, kagu avasüli võtab vastu mind iga linnajagu Meriväljalt lendan kuni Piritani nii, et silmad punased, sugu iive, käib nali Tallinnas paradiis või põrgu nagu Dantel kaitset pakub mul Russalka vihmamantel ja ka Balti Jaam pole ainult vaksal siin jook on odav ja Maitsva Volde baar siis musta keldri mägi, käime läbi Lasnamägi Tallinn roheline linn, lilli täis on Tõnismägi ja kõik Kolõvani on naised, oh my god pole kohta siin linnas kus **** saaks kuigi mõni on paks, mõnel karv kasvab niplil ja mõni on naiivne nagu muster köögikitlil kuid naised pole ainsaks meelerahu täiteks hulga meenutusi, väärt kohti, näiteks Kalamaja...Kopli ja siin ma laulmata jätta ei saa-aa tadidi-tamm-dada-didi-dadi-tamm sinna viivad sind number 1 ja 2 tramm kui pidu siin käib igas baaris igas klubis siis hommikul kell 5 ärkan Vanalinna pubis Tallinn mu kodu Tallinn aajee Euroopia ja Aasia pulmareisi turnee www.Tallinn ee Chrous x2	et
2001	19	143	Jüri Homenja	Klaver 	lyrics-juri_homenja-klaver	1	Päevinäinud tiibklaver uhkelt üksinda keset kõrbe, sirge rühiga seisjad seal täiskuu paiste all Jutu järgi ta jättis kord sinna kunagi ammu mees, kes kirjutas naisele laulu keda ta armastas Lõgismadudel koduks on saanud koht keelte kõrval Klaver liivas ja kuumuses väärikalt pudeneb koost Jutu järgi sai kuulsaks see laul,mida teab igaüks meist Kõigil teadagi ilusaid viise päästab valla vaid arm Aga armul on võime Ta, kui tahab, siis võib kõike muuta Päiksepaistest saab vari ja tinaks võib muutuda kuld Mõlemad neist olnut hoiavad meis see laul rambivalgusest säravaim õis Ja kulunud klaver kõrbetuulte sees Sellest väsinud vaevatud pillist käivad müüdid Klahve puudutades võlub muusika, algav päev On ta haud või hoopis sa ta püha laegas Sõltub,mida sa ise sealt otsides näed Aga armul on võime Ta, kui tahab, siis võib kõike muuta Päiksepaistest saab vari ja tinaks võib muutuda kuld Mõlemad neist olnut hoiavad meis see laul rambivalgusest säravaim õis Ja kulunud klaver kõrbetuulte sees Ja kulunud klaver kõrbetuulte sees Ja kulunud klaver kõrbetuulte sees Klaver... kõrbetuulte sees... Klaver... kõrbetuulte sees... Klaver... kõrbetuulte sees... Klaver...	et
2001	20	103	Smilers	Upun su silmadesse 	lyrics-smilers-upun_su_silmadesse	1	mul pole õhku ma lähen lõksu ei ole nalja siit tulla välja mu kõri kuivab ma tahan juua ma andsin sõrme sa võtsid terve käe sul pole mingit õigust peksta mu südant põrmu mind nagu maffia filmis jalgupidi tsemendis sa hoiad ja ma tunnen kuidas upun MA LÄHEN PÕHJA MA LÄHEN ALLA SEST SINUTA EI SUUDA MINUTITKI OLLA MA EI KAHTLE JA MA EI OOTA MA TEAN ET ABI POLE KUSAGILT MUL LOOTA MA OLEN SELGE MUL HEA ON OLLA MA LASEN PISARATEL ENDA PEALE TULLA MA LÄHEN PÕHJA JA ANNAN ALLA NII SU SILMADESSE SÜGAVAMALE VAJUN MA sa avad ukse ja kutsud sisse mul pole pääsu ma tulen ise sa teed mind nõrgaks sa teed mind katki ma andsin sõrme sa võtsid terve käe ja langeb nagu loor su siidist kimono ei tea kust oled tulnud mind ainult ajad hulluks mind hoiad ja ma tunnen kuidas upun	et
2001	21	100	Blue Lagoon	Take You to Paris 	lyrics-blue_lagoon-take_you_to_paris_radio_	1	Sunday morning, rain keeps falling on the streets on while you still sleep. And if I wake you up and rain will stop I gonna take you to Paris. Close the door and even more you made just trip away for here. And if you can't remove then I will prove my love and take you to Paris. Sunday morning, rain keeps falling on the streets on while you still sleep. And if I wake you up and rain will stop I gonna take you to Paris. Sunday morning, rain keeps falling on the streets on while you still sleep. And if I wake you up and rain will stop I gonna take you to Paris. Paris, Paris, Paris... Sunday morning, rain keeps falling on the streets on while you still sleep. And if I wake you up and rain will stop I gonna take you to Paris. Close the door and even more you made just trip away for here. And if you can't remove then I will prove my love and take you to Paris.	en
2001	22	98	Marko Matvere	Tähed teavad (Les Miserables) 	""			
2001	23	90	Tuberkuloited	Südaöö õied 	lyrics-the_tuberkuloited-sel_oosel_ma_kinkisin_lilli_sudaoo_oied_	1	Nägin kuidas õhtu kustus, loojang punas vees. Nägin aga siis ta uppus kaugemal mu ees. Ootasin sind kaua, seisin vastas pikal teel. Kui sind poleks tulnud siis vist oodanuks ma veel. Saabudes sind embasin ja tundsin süda lööb Ja lilled õide puhkesid me ümber keset ööd REF: Sel öösel ma kinkisin lilli neid murda ei saanud sa armastad neid Punaste õitega lilli, On puhkenud siin tuhandeid Need lilled jäägu kaunistama seda ööd ja teed Kus minnes algab igavik meid surematuks teeb Me kaugeneme pimedas siis enam meid ei näe Ja öistest punavlilledest saab värvi algav päev Oleksime tahtnud saada eilset tagasi Meid kaasa võttis endaga minema viis REF: Sel öösel ma kinkisin lilli neid murda ei saanud sa armastad neid Punaste õitega lilli, On puhkenud siin tuhandeid	et
2001	24	89	Caater	Free my body 	""			
2001	25	87	Cool D	Täna ma chillin 	lyrics-cool_d-tana_ma_chillin	1	Lõpuks ma nüüd tunnen, jälle aeg on käes sest niheleb mu perse ja sügelevad käed kuuseis ja tähed täna tähendavad ühte kodust lähen välja, ei tule enne kahte jumal andis märku, täna on see aeg põrgu kõik muu, ma ennast maha laen sest tean siin planeedil on selliseid veel kel sama tunne, tajub kuues meel kodust lähen välja ja ukse panen lukku et geoloog ei tulex minu tuppa tuttu seibi võtan palju sest magu ei joo prahti 24 h tervitan öövahti kes öötunnil minu käest ootab saada raha tervitab, on viisakas ja poeb välja nahast eemal jälgib ment mind kui sõbralikku kaani sest mul ei ole kurja tegemise plaani siis me koos nurga taga teeme kiirelt savu mis iga kupli alla vaid külvab õnnist rahu niiske on ta päts kuid sõnu ma ei söö enne kui lasen jalga, ütlen adjöö Chorus (2x): Täna ma chillin vaid kalamarja söön (aii aii) täna ma chillin kuid naisi ei löö (aii aii) täna ma chillin teen seda kogu öö (aii aii) täna ma chillin ja ei meenugi töö (aii aii) Uksed igal pool on minu jaoks lahti ma olen nagu kõuts, kes peab linnukeste jahti puudub stress ja vastus on 'Yes' sest öösel võib teha mis iganes plaane veel jagub ka enne kella kahte sest tütarlaps on üksi ja mu vastu nõnda lahke täiskuu me jaoks siis valgustab üht kohta kus siseneda saan, segajaid ei kohta rääkida ei saa, sul on miskit suus kuid tead neid nippe, sest miski pole uus siis aga jooksevad kõik baari poole tormi see koht hakkab meenutama väikest seafarmi kus üks põmm peas, sõidab teisele lõuga kuid mul on sellest kõrini, ei aja läbi jõuga edasi ma chillin kuid teen seda mujal kus vägivaldset poosi ei soosi ebajumal oli hoopis plaan, et mängin täna sõela joon palju kuid veeni ei pane nõela milleks on vaja surma minemise loosi sisse võtan elu nautija poosi Chorus (2x) Täna tahan armastada ühte neidu või kahte ja kolme kui neid ainult leidub nii kulgeb mööda linna kuigi pole kaine nagu seda nõuab Keskerakonna maine jooki peale kallan nagu Kalev Kallo Jakko Välile rögisen ma 'Hallo' nende meestega me teeme täna toopi savupiibu ajal kuulame Uno Loopi rahvas nõuab oma, kes palehigis töötab kuid riigimees nende kulul ennast täis saab joota nagu teevad nemad, laseme kõigel minna sest peomelanhoolia on vallutanud linna olgu siis nii, klaasid valame triiki ja kuulame seda funky beat'i sest aega on vähe, varsti koidab uus päev mil üle ajab magu ja värisevad käed Chorus (2x) Laual veini tõndab? aeg kuude päevad jõudu laeb kestab veidi tants ja naer ohohoh ooooooo...	et
2001	26	86	Nightlight Duo	Veel kord 	lyrics-nightlight_duo-veel_kord	1	Sinu jaoks on elu kui kaardimäng Sul on külm sest süda on lihtsalt jääs Üksi toas, kus vaikus on sulle kuld Või kardad valgust ja tuld Raha hääl kas kõneleb nüüd su eest Rikas pruut ja sa polegi vaene mees Kas valed mõtted aina keerlevad peas Ei kuldsed südamed sind oota ju reas Refrain: Veel kord armastust päästa püüan Veel kord kauneimaid tundeid säästan Veel kord ei loobu sest kõigest ma Ükskõik mis nüüd saab Me romaan nüüd lõppeda võikski siin Kuid ma näen on üksindus sulle piin Ütled küll et armastus meile jääb Ei seda peatada saa võõrad käed Refrain: Veel kord armastust päästa püüan Veel kord kauneimaid tundeid säästan Veel kord ei loobu sest kõigest ma Ükskõik mis nüüd saab	et
2001	27	79	Terminaator, Kärt Tomingas	Tänapäeva muinaslugu 	lyrics-terminaator-tanapaeva_muinaslugu	1	Õhtu saabunud on juba, kelleltki ei küsi luba ta. Unenäos käib külaline, keda harjund seal ma kohtama. Minutid läevad, tunnid ja päevad, igatsus hinge rahutuks taas teeb. Vahel tahan öelda seda aga liialt kardan teda ma. Tema tunneb saladusi, mida koolis ei saa õppida. Õli vaid tulle, kallaks kui sulle, räägiksin ära kõik mis südamel. Tänapäeva muinaslugu algas ükskord siin, koolitrepist üles tulles sind kui riivasin. Seda mängu liiga kaua mängind oleme ma ei küsi, sa ei vasta, nii me lihtsalt koos vaid vaikime. Vahel puutun tema varju, sellega vist eal ei harju ma. Une uduloori sinas, kaugeis paigus võime rännata. Ja taas minutid läevad, tunnid ja päevad, ära ei lõppe see uni kunagi. Tänapäeva muinaslugu algas ükskord siin, koolitrepist üles tulles sind kui riivasin. Seda mängu liiga kaua mängind oleme ma ei küsi, sa ei vasta, nii me lihtsalt koos vaid vaikime.	et
2001	28	75	Sepo, Siim & Sokk	Kui meie raadios räägime 	""			
2001	29	71	Caater	Sinuta 	""			
2001	30	70	Exit	Loverboy 	lyrics-exit-loverboy	1	trrrr (2korda) hallo . Je thats me no I'm not your loverboy. Loverboy	en
2001	31	68	Meie Mees & TTÜ naiskoor	Moskva 	lyrics-meie_mees-moskva	1	Moskva - jäine ja tuuline õhtu kui hiline käib üle maa moskva - külm on su kange viin viisnurga kuum rubiin lööb hõõguma Tovariz dai-dai-dai-dai viinuzkit veel see on kui lõikav kasaka mõõk natasa hoi-hoi-hoi-hoi voodisse veab eh harazoo saab meil olema seal R: moskva moskva kremli müürid punased esmaspäevad sinised oh-oh-oh-ohoo moskva moskva sinu hing on suur ja lai saatan tihti külas käib ah-ah-ah-ahaa moskva moskva kaaviar ja valge viin hapukurk ja hingepiin oh-oh-oh-ohoo moskva moskva kuldsed kuplid kõrguses liisund õlu nina ees ah-ah-ah-ahaa Moskva -sünge ja särav see eilsesse värav see punane kuld moskva - kes sinu südant teab armastab sind või neab kõigest saab muld Tovariz dai-dai-dai-dai viinuzkit veel  R:moskva moskva kremli müürid punased  Laua peale lao tavaar pane käima samovar oh-oh-oh-ohoo moskva moskva vodkat veel üks klaasitäis terve ilm on maani täis ah-ah-ah-ahaa.	et
2001	32	67	Žorg	Eat me alive 	""			
2001	33	66	Hovery Covery	Puudutus 	lyrics-hovery_covery-puudutus	1	üksinda istun kodus ja mõtelen kuidas me oleme koos kuidas mind vaatavad sinu silmad ja mis on su soov kuidas küll tahaks et sa mul oleks kõrval kogu aeg sõnu ei olegi alati vaja sa tead mis ma vajan Vaid su puudutus on see mida tahaks tunda veel ja veel vaid su puudutus on see mis muudab soojaks südame Vaid su puudutus on see Sinu naeratsus sinu silmad kuidas küll vajan neid üksinda olles muust ei mõtle vaid kujutlus on neis kuidas küll tahaks sulle ma öelda et sind armastan kuidas küll tahaks ka seda tunuda kuidas sind kallistan Vaid su puudutus on see mida tahaks tunda veel ja veel vaid su puudutus on see mis muudab soojaks südame	et
2001	34	62	Smilers	Mõtlen sinust 	lyrics-smilers-motlen_sinust	1	täna ärkasin vara on väljas külm ja lumi maas üle tõsiselt pika aja vähe päikest näha saab olen lihtsalt niisama kuulan lenny krawitz'it ja mõtlen et sa võiksid olla siin mu päevad on pikad usu ööd on veel pikemad aga mul pole viga võin öelda saan endaga hakkama unistan sinust ja suvest vaid ja sellest kuidas koos rannas sööme maasikaid voodis vedelen üksinda mõtlen sinust mu maailmas silmad sulen ja hetkeks viib sinu juurde mind tumesinine satiin palju maad palju aega jääb me vahele ma nii tahaks teada et mida sa hetkel teed ma tunnen sust puudust iga sekund ja minut ja tund fantaasiatega sinust kiusan end täna ärkasin vara pool üksteist on vara minu jaoks joon paar cappucino't ära ja su pildid ritta laon ma unistan sinust ja hea on nii ja ma tunnen et sa võiksid olla siin	et
2001	35	61	Dave Benton	Mas Que Un Millon (She	lyrics-dave_benton-m_s_que_un_mill_n	1	Más que un milagro falta pa borrar lo que hice yo. Te hice daño y hoy yo sufro grande es mi error. Ya no estás y me di cuenta que no vivo sin tu amor. Hoy me duele la conciencia te pido perdón. Tan siquiera tu mirada que me da calor. Si no estás, no pasa nada y me muero yo. Ya no me importa más saber quién soy, ni de donde vengo y por dónde voy. Y si me ofrecen más de un millón cambiaría todo por tu amor. Todas las noches me hacen largas y me ahogo con alcohol. Como anhelo tu llamada hazme el favor. Basta de ser orgulloso, hoy me pongo en tu lugar. Si te llamo no me niegues la oportunidad. Ya no me importa más saber quién soy, ni de donde vengo y por dónde voy. Y si me ofrecen más de un millón cambiaría todo por tu amor. Tan siquiera tu mirada que me da calor si no estás, no pasa nada y me muero yo. Ya no me importa más saber quién soy, ni de donde vengo y por dónde voy. Y si me ofrecen más de un millón cambiaría todo por tu amor. Ya no me importa más saber quién soy, ni de donde vengo y por dónde voy. Y si me ofrecen más de un millón cambiaría todo por tu amor.	es
2001	36	60	Caater	King siže 	""			
2001	37	59	Terminaator	Raudteejaam 	lyrics-terminaator-raudteejaam	1	Sa kustutasid tuled End sooja teki sisse mähkisid Ja argipäeva mured Su hinge rasked jäljed trampisid Ja nüüd sa tead Miks on kirjutatud read Vana reudteejaama seinale Nii igal õhtul peidad End oma kambris külmas pimedas Vaid latern varju heidab On raudteejaam su korvaltänavas Ja nüüd sa tead Miks minema pead Sind oodatakse pikkisilmi Vaksalis kus kirjutatud read: Sa oled parim Mis on juhtund minuga Annad jõudu elada ja ootan sind paigas Mis mulle püha Salakeeles kirjutan Seda et sind armastan Ja koidikul kõik märgid ma kustutan Kohtume mustvalges filmis Päiksetõusul ja su silmis Läiget märkan, mida Tundnud olen sajandeid ja tean et Raudteejaama saladused Täitumata unistused Tõelisuseks muutuvad, sest Maailm leiab värvid üles Siis kui oled minu süles Sa oled parim Mis on juhtund minuga Annad jõudu elada ja ootan sind paigas Mis mulle püha Salakeeles kirjutan Seda et sind armastan Ja koidikul kõik märgid ma Ja koidikul kõik märgid ma kustutan, jajajajaa Shalalalalaa jaa ma kustutan, märgid kustutan, jajajaa jaja ja koidikul kõik märgid ma kustutan,	et
2001	38	58	Smilers	Meteoriitide sajus 	lyrics-smilers-meteoriitide_sajus	1	mul juhtus imelik asi laupäeval  jalutades mind haaras kinni korraga käest ühesilmaga paks mustlane ta rääkis segases keeles ja kirus hambutul suul ta ütles et pean veel ootama õnne ja et õnn on just praegu peruus ja kõik läks täpselt nii nagu pidi ma omal nahal kõik tunda sain MA SEISAN METEORIITIDE SAJUS JA MUL EI OLE EI KÜLM EI SOE JA KUIGI MAA MINU JALGE ALL VAJUB MA EI KARDA JA PEITU EI POE MA SEISAN SIIN NO KASVÕI KOLMSADA PÄEVA JA KUI ON VAJA SIIS KA ROHKEMGI VEEL MA TEAN ET ÜKSKORD SA IKKAGI TULED MINU JURDE TEE KÜLL SA LEIAD VEEL ma olen kuulnud üht juttu et õnn on ainult üks hetk ja et igaüks eraldi meist iseendale on selle sepp ja kõik on täpselt nii nagu pidi ma omal nahal kõik tunda sain	et
2001	39	57	Tuberkuloited	Hele pael su juustes 	lyrics-the_tuberkuloited-hele_pael_su_juustes	1	hele pael su juustes ühte värvi taevaga valendamas mereäärses tuules vaikus meie hinges laulab katkematut viit laulu mille sõnu ma ei kuule ära küsi miks ma tahtsin tunda seda veel nagu ükskord ammu tulla siia ja su naeratuses näha tulevikku taas tahtsin veelkord endaga sind viia hele pael su juustes lendab tuules nagu muinasjutt on see kõik on alles olles sinuga ma kindlalt tean et kõik on alles ees iga aeg on õige nii ka praegu mööda mereäärset teed minu autos hele pael su juustes lootus elab kusagil su sees teed mis viiksid välja on kaardilt kadunud ainus tee viib tagasi su juurde hele pael su juustes ühte värvi taevaga lendab ära laotusesse suurde	et
2001	40	56	Tuberkuloited & Urmas Voolpriit	Tantsin valssi 	lyrics-the_tuberkuloited-tantsin_valssi	1	"Siis, kui sind nägin esimest korda koputas saatus vist õlale mul. Tundsin, et oledki see keda ootan. Tundsin, et olen su järele hull. Veidi ehk kartsin, kui nägin sind jälle. Ometi kutsusin tantsima sind. Naeratus huultel sa tulid, ma tundsin, miski su sees oli oodanud mind. Ref: Sa tantsi valssi, seda valssi, ühtainust valssi minuga. Ma tantsin valssi, jah ainult valssi. Sa tantsi valssi minuga. Päeval ja öösel nüüd igatsen sinna, kus laupäevaõhtuti tuledes saal. Ootan veel valssi, et tantsima minna, ja et siis saata sind koju võiks taas. Küsivalt uksel sa seisatad korraks, naeratad vaid, kui ma ütlen: \""head ööd\"". Kerge ja hea on mul tee läbi linna. Kusagil kaugel kel süda ehk lööb. Sa tantsi valssi, seda valssi, ühtainust valssi minuga. Ma tantsin valssi, jah ainult valssi. Sa tantsi valssi minuga. Na na na na na na na na na na. Na na na na na na na na nanana. Na na na na na na na na na na. Na na na na na na na na nanana. Sa tantsi valssi, seda valssi, ühtainust valssi minuga. Ma tantsin valssi, jah ainult valssi. Sa tantsi valssi minuga. Na na na na na na na na na na. Na na na na na na na na nanana. Na na na na na na na na na na. Na na na na na na na na naaa."	et
2002	1	1882	Terminaator	Romula 	lyrics-terminaator-romula	1	Õhtu saabunud ja vaikus võtab maad ohkab väsinuna vana romula Täna jälle toodud siia tuhandeid purunenud südameid Kallis, palun võta enda teadmiseks, et mu hing on müüdud varuosadeks Enam pole miskit teha sellega, nüüd mind ootab romula Sinna, sinna, sinna lähen ma kus on murtud südamete romula Seal võib üksi liikumatult lamada keegi enam mulle halba teha seal ei saa Tüdruk, ma ei tulnud sulle kurtma vaid, tahan, et sa teaksid, palju haiget sain Nüüd mu kuju oma mälust kustuta, sest, et ma pean minema Sinna, sinna, sinna lähen ma kus on murtud südamete romula Seal võib üksi liikumatult lamada keegi enam mulle halba teha seal ei saa Sinna, sinna, sinna lähen ma kus on murtud südamete romula Sinna, sinna, sinna lähen ma kus on murtud südamete romula Seal võib üksi liikumatult lamada keegi enam mulle haiget teha seal ei saa	et
2002	2	1568	Meie Mees	Sinine Vilkur 	lyrics-meie_mees-sinine_vilkur	1	TÄNAVAL LÄRMAB KURJA MOEGA VINTIS MEES SININE VILKUR SININE VILKUR RAHUSTAB NEID KEEGI MU KORTERI ON TÄITSA TÜHJAKS TEIND SININE VILKUR SININE VILKUR OTSIB NEID LA LALAA SININE VILKUR SININE VILKUR AITAB MEID LA LALAA SININE VILKUR SININE VILKUR KAITSEB MEID HOMMIKUL AUTOT POLE ENAM AKNA ALL SININE VILKUR, SININE VILKUR LEIAB NEID ÜLIMAT KIIRUST MAANTEEL PROOVIB MERSU VEND SININE VILKUR SININE VILKUR PEATAB NEID LA LAA SININE VILKUR SININE VILKUR AITAB MEID LA LAA SININE VILKUR SININE VILKUR KAITSEB MEID RAHUTULT TRIIPU TÕMBAB BAARIS UIMAS SELL SININE VILKUR SININE VILKUR KARISTAB NEID MAGUSAT JUTTU TÕUKAB KLUBIS SLAAVI BEIB SININE VILKUR SININE VILKUR HOIATAB MEID LA LAA SININE VILKUR SININE VILKUR AITAB MEID KAITSEB MEID HOIATAB MEID	et
