year	rank	votes	artist	song	filename	source	lyrics	language
2011	35	88	Koit Toome	Mälestused 	lyrics-koit_toome-malestused	1	leidsin sahtli põhjast ma vana foto ning jäin vaatama mu elus olnud hetki inimesi, ennast ka Pooljuhuslikult siis ajas tagasi ma rändasin ja nägin ennast taas majas kus ma kasvasin mälestusi täis on atmosfäär vaatan häid kui halbu ma ei näe et ei hooli, neist ei hooli on hetki mida võime korrata ja on kordi millest mööda tormata et ei hooli, neist ei hooli õues rooste läinud kiik lapsed mängisid kõik siin see oli nagu eile see jõuab taas minuni sellel pildil olen ma oma esimese sõbraga vahel küsin endalt mõttes mis on temast saand mälestusi täis on atmosfäär vaatan häid kuid halbu ma ei näe et ei hooli, neist ei hooli on hetki mida võime korrata ja on kordi millest mööda tormata et ei hooli, neist ei hooli pildid jooksevad mu silme ees neid tundeid mäletan veel jäävad alatiseks minuga võtan kaasa endaga.. mälestusi täis on atmosfäär vaatan häid kuid halbu ma ei näe et ei hooli, neist ei hooli on hetki mida võime korrata ja on kordi millest mööda tormata et ei hooli, neist ei hooli Mälestusi täis on atmosfäär, et ei hooli, neist ei hooli. On hetki mida võime korrata ja on kordi millest mööda tormata et ei hooli, neist ei hooli	et
2011	36	85	Beebilõust	Mendid 	lyrics-beebiloust-mendid	1	Hei, hei, hei yo ma ütlesin teile, ma ütlesin teile, et asi läheb karmiks, nahhui! Türapea ütle mis ment sa oled, ah!? Narkoment või gestaapo ment, ah? (sitt raisk) KaPo mendid (on pohhui) narko mendid (on pohhui) me lihtsalt saadame perse need mendid! Gestaapo mendid (on pohhui) narko mendid (on pohhui) me lihtsalt saadame perse need mendid! KaPo mendid (on pohhui) narko mendid (on pohhui) me lihtsalt saadame perse need mendid! Gestaapo mendid (on pohhui) narko mendid (on pohhui) me lihtsalt saadame perse need mendid! Ma olen näind igat liiki neid mendi närakaid, kuid ühed naglamad-munnimad mendid on tänaval patrullivad mendid. Need mendid pole lulli lööjad mendid, sest siis kui sul on pinna pidu, need mendid su korterisse tungivad, mendid. Üle tunnitöö mendid ja abimendid, töötavad kui masinmendid, sest need mendid tahavad olla mentide mendid, ehk ülemusmendid. Kannavad ka kodus kumminuia, sest need mendid on pühendund mendid. Mõned mendid on muteerund mendid, korrumpeerund mendid, antisotsialiseerunud ja isegi suhu võtjad pedereerunud mendid, mõne mendi muusa Roboo-cop need mendid on mendifilmide matkijad mendid, kellest võim on teinud tapja mendid, paar aastat srokki teeb tapjamentidest süüdi mõistetud eksmendid, menditapja istub eluaegset, teeb tsoonis eksmentidest seksmendid, vägivallaga rääkima sundivad mendid on gestaapo mendid, narkomendid või KaPo mendid, kuid mingu perse need mendid, kõik on üks suur pere, euroopa, gestaapo, NATO mendid. KaPo mendid (on pohhui) narko mendid (on pohhui) me lihtsalt saadame perse need mendid! Gestaapo mendid (on pohhui) narko mendid (on pohhui) me lihtsalt saadame perse need mendid! KaPo mendid (on pohhui) narko mendid (on pohhui) me lihtsalt saadame perse need mendid! Gestaapo mendid (on pohhui) narko mendid (on pohhui) me lihtsalt saadame perse need mendid! Ma olen näind igat liiki mendinärakaid, kuid ühed juhmimad-lollimad mendid on mun-poli rolliga mendid, need mendid on kui poolikud mendid, nagu need üheksakümnendate alguse erikooli paberiga mendikoolita mendid. On siniverelised sündind mendi sündroomiga mendid, tollis narkoäri kontrollivad mendid, ei räägita niisama et mendid on sead, kui on olemas mendid kes tõepoolest on seamolliga mendid, on KPZ mendid, panevad rotti su TP need mendid, ja veel on saare PP mendid, ehk TONT mendid Väli, Põldemaa, Kõpu, ja teised siinsed action-mendid, ja VSOP mendid, mätta-mentide legendid, konstaabel Mänd ja Rätsep Lembit, kelle sarvesaia  fiasko liigitab ta - söödikmendid. Nad siin pimelinnas pidevalt dilemma ees, et kas söörik või Elbing, söörik või Elbing. Kõik need mendid kes mu söna kuulsid on nüüd kompleksides, end ära tundnud mendid, mu kodu poole suundund mendid, kuid mingu perse need mendid, tervitan neid hambuni relvis, sest ainukesed mendid kes mulle meeldivad on surnud mendid. KaPo mendid (on pohhui) narko mendid (on pohhui) me lihtsalt saadame perse need mendid! Gestaapo mendid (on pohhui) narko mendid (on pohhui) me lihtsalt saadame perse need mendid! KaPo mendid (on pohhui) narko mendid (on pohhui) me lihtsalt saadame perse need mendid! Gestaapo mendid (on pohhui) narko mendid (on pohhui) me lihtsalt saadame perse need mendid!	et
2011	37	84	Ines	Tule-Tule 	lyrics-ines-tule_-_tule	1	Asfald kõrbeb, õhk on paigal, kontsad kleepumas. Otsin tuult ma, vajan merd ma. See kõik mind nii jahutas. Rebin riided, viskan kingad, jooksen minema. Linnast ära, eemal mürast, viin närvid kõik surfama. Ootan sind lainte keskel, sammu kaugemal. Neid ainulaadseid hetki seal saame jagada. ref. Tule-tule tuul nüüd siia. Puhu ära soolapiisad. Päeva mured kõik on läind. Mõtlen sinust, kus sa jäid. Sinu huuled, minu kaelal. Välk mind läbistab. Meie meri, meie suvi, sõrmed koos põimumas. Ootan sind lainte keskel, sammu kaugemal. Neid ainulaadseid hetki seal saame jagada. ref. Tule-tule tuul nüüd siia. Puhu ära soolapiisad. Päeva mured kõik on läind Mõtlen sinust kus sa jäid. Leia-leia mind nüüd laine. Võta ära linna kaine. Rannaliivalt kõik on läind. Mõtlen sinust kus sa jäid Ootan siin lainte keskel kaaauugemaal. Sind vaja lõõm, sinu kirg ja hõng kõik halvatab ta. Sinu hääl ja lõõm, sinu kirg ja hõng, kõike neelata saab. ref. Tule-tule tuul nüüd siia. Puhu ära soolapiisad. Päeva mured kõik on läind. Mõtlen sinust, kus sa jäid. Leia-leia mind nüüd laine, võta ära linna kaine. Rannaliivalt kõik on läind. Mõtlen sinust, kus sa jäid. ref. Tule-tule tuul nüüd siia. Puhu ära soolapiisad. Päeva mured kõik on läind. Ma mõtlen sinust, kus sa jäid. Leia-leia mind nüüd laine, võta ära linna kaine. Rannaliivalt kõik on läind. Ma mõtlen sinust, kus sa jäid.	et
2011	38	83	Iiris	Melyse 	lyrics-iiris-melyse	1	If you believe in dreams And the trance-like state That will come around When you’re not awake Then once in the sea of thoughts I saw raging sharks Biting bits into my camouflage Hey! The lights are breaking I see all the worlds go past I never stop! O-oh! The lights are low! Turn the page, and let it go! O-Oh! The lights are low! Turn the page and let it go! Melyse are you still awake? Melyse are you still okay? They told me to turn away From a dead way Making my teeth fall out In the strangest way I was the calmest one In the dream that day With no teeth I had nothing to say Headlights are breaking I see all the worlds go past I never stop! O-oh! The lights are low! Turn the page and let it go! O-oh! The lights are low! Turn the page and let it go! So when I woke I played a game With all the promises you made But I don`t see you in my dreams no more No more No, I don`t see you in my dreams no more Hey the lights… Melyse you`re not awake! They are…. Melyse you’re not okay! O-oh! The lights are low! Turn the page and let it go! O-oh! The lights are low! Turn the page and let it go! O-oh! The lights are low! Turn the page and let it go! O-oh! The lights are low! Turn the page and let it go! Melyse you’re not awake Melyse you’re not okay	en
2011	39	82	Respekt	Upun Pisaramerre 	lyrics-respekt-upun_pisaramerre	1	Ma igal öösel soovin soove täitmatuid et sõnu sulle ma oleks lausuind laitmatuid kus oled sa kallis upun ma Upun pisaramerre nii segi kõik mu sees upun pisaramerre see kõik on sinu eest päästke mind oled eksinud hing päästke mind ja oled liiga kaugel maast vaid ennast päästa saad upun pisaramerre Miks peitsin tundeid ma tõelisi siis sinu eest miks siis ei julgend olla aus ma enda sees kus oled sa kallis upun ma Upun pisaramerre nii segi kõik mu sees upun pisaramerre see kõik on sinu eest päästke mind oled eksinud hing päästke mind ja oled liiga kaugel maast vaid ennast päästa saad upun pisaramerre upun pisaramerre 4x nii segi kõik mu sees( kõik minu sees) upun pisaramerre see kõik on sinu eest päästke mind oled eksinud hing päästke mind ja oled liiga kaugel maast vaid ennast päästa saad upun pisaramerre	et
2011	40	80	Dj TT	Üksinda 	lyrics-dj_tt-uksinda	1	Ma pole üksinda, üksinda, üksinda mu hinges elad sa, elad sa, elad sa ka siis kui pole sind, pole sind, pole sind ei nuta kurbusest mu hing (hing, hing, hing) tuled sa nüüd kustuta, see öö on vaid meile heida minu kõrvale ja oleme koos kui olnuks kõik eile kingin need sulle kui lubad et su süda kuulub mulle ei oota homset sest tean et lahkud varavalges Ma pole üksinda, üksinda, üksinda mu hinges elad sa, elad sa, elad sa ka siis kui pole sind, pole sind, pole sind ei nuta kurbusest mu hing (hing, hing, hing) Ma pole üksinda, üksinda, üksinda mu hinges elad sa, elad sa, elad sa ka siis kui pole sind, pole sind, pole sind ei nuta kurbusest mu hing (hing, hing, hing) Ma pole üksinda, üksinda, üksinda mu hinges elad sa, elad sa, elad sa ka siis kui pole sind, pole sind, pole sind ei nuta kurbusest mu hing annan sulle end, end, end, end, end sind armastan maaaa kingi mulle end, end, end, end, end ei pea pettuma ma pole üksinda	et
2012	1	1385	Põhja-Tallinn	Meil on aega veel 	lyrics-pohja-tallinn-meil_on_veel_aega	1	Refrään (2x): Vahel vaatame taevasse, kas meil on aega veel, kui ei ole siis seda millegi arvelt laename. Meil on aega veel, meil on aega﻿ veel, kõigil on aega veel. Asjad võtavad aega alati enne kui nad realiseeruvad Meil on aega tegelt nagu vanasti, lihtsalt elu on keerukam Et ma tean mida teen, kuid ei tea, mida teen, terve elu teen veel, kõige jaoks on aega veel, et mõtlen enne kui teen kuid﻿ kõhklen, siis mõtleme veel ja ma ei viska aega maha, sest tean, et aeg on raha et kõige jaoks on aega täpselt niipalju, kui ise tahan ma lihtsalt ei kiirusta millegis ette või kujuta ette, et sa elad aind hetkes. Kui kuskile hilinen, siis alati on virin, et miks, ma ju pidin, kui eks jään siiski aint inimeseks. Vahel end unustan ja aega siis kulutan ma, kuid meil on aega veel, kui ei, siis kuskilt laename. Miski ei nõua mult pühendumust, kuid olengi pühendunud, kõik ei käi kella järgi, alati ei toimi lühem marsruut. Aega ja kannatust vaid aeg näitab armastust, vaid aeg annab andestust, aeg avab silmad ja suu. Refrään (2x): Vahel vaatame taevasse, kas meil on aega veel, kui ei ole siis seda millegi arvelt laename. Meil on aega veel, meil on aega﻿ veel, kõigil on aega veel. Iga hommik on neetud, äratab mobiilivärin, kas pea on patja kleepunud või kõuts varvast närib. Kui on aega veel, teen asju aeglaselt, siis vähetähtsad asjad kõrvust mööda vahel lasen. A kui ei vea nii välja, siis otsin otsemat teed, Tean see mis mind ootab, ei jookse mul eest. Nii sunnitakse tagant, tegelt ise ka ei tea, kuhu sõuad, siis ütlen, et pea lõuad, igale poole ei peagi jõudma. Aga ma ei jõua, ma ei jõua, ma nõuan endalt, et jõuaks. Kui sisse magan, jõuan tööle alles poolest lõunast ja kui täna ei lähe, luban homme topelt teenin, mul on terve maailma aeg, mis mind motiveerib. Ma ei pane tuima ätini, kuni süda veel hüppab ja ei oota ka, et keegi kanni oda lükkaks. Kuid kui midagi põhja kõrbeb, siis siin ei aita ka Mentos ja ma ei saa toppama jääda, kui elu on teind mulle tempo. Refrään (6x): Vahel vaatame taevasse, kas meil on aega veel, kui ei ole siis seda millegi arvelt laename. Meil on aega veel, meil on aega﻿ veel, kõigil on aega veel.	et
2012	2	947	Põhja-Tallinn	Lähen ja tulen 	lyrics-pohja-tallinn-lahen_ja_tulen	1	ma pööran korraks selja ja kui vaatan tagasi on kõik läbi, mis polnd veel alandki hetkega lihtsalt nii palju muutub hetkeks siit kaon, kuid naastes kõik puudub näen bensu hind langeb peab võtma täispaagi hiljem tagasi tulles on see taas laeni alati kui on tähtis kõne kaob levi ja hakib või aku tühi ainus laadija on kodus kapil kõik mu head plaadid hüppavad mu automakis ja raadiost kuulatavat materjali napib alati kui on allahindlused, on otsas mu papid ja palgapäev on alles millal.. oh fuck it iga päev kallineb söök, jook ja suitsupakid reedel pigistab ka tilga liksi, siis kui klapib ükskõik kui palju püüan, rapsin ja laksin, tuleb välja, et kõigele ikka peale maksin Refrään(2x): vahel võiks kõik olla nii, et miski ei muutu kunagi, et ma lihtsalt lähen ja tulen ja lähen ja tulen ja kõik on ikka veel siin jälle sama pilt, külmkapis toit on aegund miks pole pangakontole mu haigusrahad laekund ja kuulõpp eriti määrib, krediiti näevad käärid rahaga on nagunii perses, niiet sellest ma rohkem ei räägi pea on pulki täis ja ise laman keset prahti mobiili otsides enam ei meenu, mis ma tahtsin unustan, ei mäleta ja pea ei mõtle ümber sest mu otsa ees on rohkem kortse kui sul neljakümneselt nii ma imiteerin tihti laisklooma nägu ei nad liigu jala kuskile, kui rattad all on kärul alati sadu saabub ennem, kui ma olen läind ja kui selga taob singaal, ammu uperkuuti käin algul kõikjal hästi läind, nüüd siis pean ma leppima kui jälle sisse investeerin pean ma katust teipima kiirelt parim kaob mu silmist, praegu peabki ostma prillid sada korda kaalul on variant, et saada tillist Refrään(2x): vahel võiks kõik olla nii, et miski ei muutu kunagi, et ma lihtsalt lähen ja tulen ja lähen ja tulen ja kõik on ikka veel siin reaalsus poseerib, sekundeerin kes kurat elu sinu eest korrigeerib kodeerin probleemid, sest elu on keeris ma lähen ja tulen, a' kumb neist domineerib ei kommenteeri, selgelt veeren keerises need reeglid mind, teenin taga, mu peegelpilt segi mida puutun laguneb, jaguneb, ma elu järele janunen tõstan panuseid, all in, ei ole täis hind, vaid pool mind on koorind, kui saanud, mis soovind ja proovind, poob mind nii juhtub, äkki ongi nii, et kergelt tuleb ja kaob nii ruttu lõppu näha juba alguses, eesmärk hävineb, kaotan valvsuse sest on üks elu, ja viib meid üks vedu kui nii, siis üks tegu ka viib, kus üks edu Refrään(2x): vahel võiks kõik olla nii, et miski ei muutu kunagi, et ma lihtsalt lähen ja tulen ja lähen ja tulen ja kõik on ikka veel siin	et
2012	3	911	Ott Lepland	Kuula 	lyrics-ott_lepland-kuula	1	Kuula, mis räägib silmapiir, kuula, kui kaugele ta viib, kuula, mis tuulel öelda veel, kuula.. nüüd. Vaata, kui pimedus on teel, oota, neis valgus püsib veel, kuula, kuis hingab sinu maa, kuula.. nüüd. Kuula, mis vaikusesse jäi, kuula, neid lihtsaid hetki vaid, sa kuula, ka südamel on hääl. Kuula, sa vikerkaare häält, vaata, ja sa peagi näed, kuula, see elamise laul, kuula.. vaid. Kuula, mis vaikusesse jäi, kuula, neid lihtsaid hetki vaid, sa kuula, ka südamel on hääl. Varjudesse tee on mööda läind, ma vaatan ja otsin ikka veel, on vaikusel see võim - heliseda sind ma ootan siin, kus poolel teel, sa kuula, hüüdmas on mu hääl. Kuula, mis vaikusesse jäi, kuula, neid lihtsaid hetki vaid, sa kuula,mu südamel on hääl. Kuula, mis räägib silmapiir, kuula, kui kaugele ta viib, kuula, mis tuulel öelda veel, kuula.. nüüd..	et
2012	4	381	Põhja-Tallinn	Nii lihtsalt ei saa 	lyrics-pohja-tallinn-nii_lihtsalt_ei_saa	1	"Kenny: Ma näen, et sul seljataga on raske päev ja et väär on küsida, miks jälle tuled ja läed Kuigi olen reisind, a neid reisi, nägin Kaubamaja taga sel päeval ja mitte teisi Vahtisin sind, mitte niisama seal seisin, võib-olla, meibi, ma olengi kreisi Ettepaneku meil tegin kasvada vanaks, mu vanemad jäljed kuluvad asfaldil maha Kindel võid olla, et hoiame jalad maad ligi ja et teiste pikad näpud meile ei saaks ligi Juba täna oleks kliima meil soojem ja sina poleks liialt must noorem REF (Maia & Wild Disease): Mind nii lihtsalt ei saa, lihtsalt ei ütle ma \""jaa\ Võid kinni püüda mind sa, kuid mind nii lihtsalt ei saa Sind rahule jätta ma ei saa, nii kaua kuni ütled mul \""jaa\ kui saan su kätte siis ma ootan nii kaua kuni ütled mul \""jaa\ Wild Disease: Ma ei saa aru, miks mind väldid, olen kena mitte tõbras Tahan panna sind... Facebookis oma sõbraks Jälgin su neid, noh... pilte sinust Mind enda juurde kisud, tekitad mul suure isu Kolin ema juurest välja, liisin auto ja korteri Ja luban, et ei laku sõpradega väljas porterit Viskan nurka klotseri ja unustan patsaanid ja luban, et kustutan mobiilist kõik need teised raamid Ma ei hõõru sulle ligi, tahan, et sa teaks, et olen ainus, kes tahab, et sul hea Toon sulle lilli iga reede ja küsin \""kallis, mis teeme?\ Ma ei mõtle üldse nii, et saaks vaid lahti seemne. REF: Fate: Ma pole tavaline perv, kuid olen terve öö sind vahtind, su piltidesse armusin, nüüd tahan saada lahti... Su südame ukse, kuhu sisse poen seal püherdame koos nii et miski muu ei loe 50 protsenti on garanteeritud truudus, teise poole 50 tagab su suudlus Ma käin tööl, kuid miks mind keeldud tahtmast? Kolime kokku, mul on kass, ära muretse, lendab aknast Ma ei mõtle fucky-fucky, kuid mis mõttes meil ei klapi? Luban kõike, et teen paremini vanast Toilet Duckist Ei kabista, näed, ulatan abistava käe Kui mu abist jääb väheks, juba tähti tooma lähen. REF:"	et
2012	5	341	Lenna	Mina jään 	""			
2012	6	339	Respekt	Anna andeks 	lyrics-respekt-anna_andeks	1	Salm 1: On kätte jõudnud aastapäev mil loobusid, Taas heidan ennast sängile su kõrvale, Ma räägin sulle lood mis on mu saladus, Ja mitte-mitte keegi, mitte-mitte iial, Nendest teada ei saa. Nii tasa pühib tuul mu põselt pisara, Nii sama tasa suu sind vaevu hüüatab, Ma tean sa oled siin ja hoiad ümber mul, Kuid peos on ainult liiv ja saan vaid öelda nii. Ref: 2x Ma palun anna andeks, et ei kuulanud Mu armas anna andeks, et ei vastanud Ma palun tiri välja meie mälestus Ja vii kaasa need, sest mäletades neid ma lõpuks kaotan tee Salm 2: Sa teadsid millest linnud öösel laulavad, Sa teadsid kuhu poole peame rändama, Sa teadsid mida öelda kui kurb mu meel, Vaid sina kallis teadsid mida vajan ma. Ref: Ma Palun anna andeks, et ei vastanud.....	et
2012	7	309	Vaiko Eplik	Soorebased 	lyrics-vaiko_eplik-soorebased	1	linge kinni loorehades linge kinni loorehades teel ja veel minge ringi, soorebased minge ringi, soorebased teel ja veel hing jäi kinni soorebased hingeringi soorebasena ümberringi soo, lebame ümberringi soo, lebame vees ja me ümber ringi soorebane ümber ringi soorebane teeb ja me hinged kinni soorebase hingeringis soorebasena hing jäi kinni soorebase hingeringi soorebasena hing käib ringi soorebase hing käib ringi soorebasena	et
2012	8	302	Ott Lepland	Imede öö 	lyrics-ott_lepland-imede_oo	1	On igaüks ju muinasjutte uskunud Just täna puhkeb õide saladuste puu Ta lõhna hingates ma nägemuse saan Kaua veel mul tuleb oodata Oo-oo-oo, muinasloo Ja muinasloo Unelmatest välja toon Oo-oo-oo, muinasloo Ja muinasloo Unelmatest välja toon Peagi paremaks meil kõik muutub Ja viimsed katted langevad me imede ööl Peagi paremaks meil kõik muutub Ja viimsed katted langevad meil siin Imede öö Oo-oo Imede öö Oo-oo Imede öö On kirjas taevatähtedes, et armastan Ja täna õhtul astuda on viimne samm No milleks nõidused, mis ei vii kaugele Õnneks meil ei ole selliseid Oo-oo-oo, muinasloo Ja muinasloo Unelmatest välja toon Peagi paremaks meil kõik muutub Ja viimsed katted langevad me imede ööl Peagi paremaks meil kõik muutub Ja viimsed katted langevad meil siin Imede öö Oo-oo Imede öö Oo-oo See imede öö Oo-oo Imede öö Oo-oo On igaüks ju muinasjutte uskunud Just täna puhkeb õide saladuste puu Peagi paremaks meil kõik muutub Ja viimsed katted langevad me imede ööl Peagi paremaks meil kõik muutub Ja viimsed katted langevad meil siin Imede öö Oo-oo Imede öö Oo-oo Imede öö Oo-oo Imede öö Oo-oo Imede öö	et
2012	9	280	Ott Lepland	Kodu 	lyrics-ott_lepland-kodu	1	Hommik taas kastab nüüd kuivand maad. Tuultes vaid lõhnab sajune aas. Vees ma käin, kõik linnud on ammu läind. Aastaaeg uus on saabunud taas. Kui vaid öö mu kannul käib, siis kõik muu nii vaikne näib. Kui kord jõuan ma koju, kus tunda saan seda, mis ammu meelest läind Vaikuses koos nüüd me seisame. Vaid sinu hõngu tunnen siin ma. Ei näe sind, kuid tean sul on kodu hing. Nüüd ära ma enam minna ei saa. Nüüd kaduvusse, lõpmatusse kaovad hing ja meel... Kui kord jõuan ma koju, kus tunda saan seda, mis ammu meeltest läind. Ukse peal seisan taas. Tahan sul rääkida - pole sind liiga kaua näind Kui kord jõuan ma koju, kus tunda saan seda, mis ammu meeltest läind. Ukse peal seisan taas. Tahan sul rääkida - pole sind liiga kaua näind.	et
2012	10	275	Artjom Savitski	Sinu juurde tagasi 	lyrics-artjom_savitski-sinu_juurde_tagasi	1	Lihtsalt vaikusesse tühje sõnu loobin ma Mitte mingisugust vastust ma ei saa Vaid mu aeg nii möödub kõik need tunnid mida ma võinuks paremini kasutada. Ainsat põhjust selleks mida teed sa minuga lihtsalt pole miskit parata Kas ei leia sõnu või siis mängid minuga vahet pole kuni kannatan ma Refr: Kui mulle silma vaatasid viis tee mind sinu juurde ja su suudlust ootasin tärkas mu's lootus kuid mind ära tõukasid alla kuristikku suurde kuid vaid lendu tõusin siis ja lendan su juurde ma ikka tagasi. Sinust pilti maalin sinust laulu kirjutan mida praegugi saad kuulata see on ainus viis ning see on ainust tee kuis ma kunagi su juurde saaks Refr: Kui seda laulu kuulasid viis tee mind sinu juurde ja su suudlust ootasin tärkas mu's lootus kuid mind ära tõukasid alla kuristikku suurde kuid vaid lendu tõusin siis ja lendan su juurde ma ikka tagasi. Tagasiiiiii... Tagasiiii.. Kui mulle silma vaatasid viis tee mind sinu juurde ja su suudlust ootasin tärkas mu's lootus kuid mind ära tõukasid alla kuristikku suurde kuid vaid lendu tõusin siis ja lendan su juurde ma ikka tagasi. Kui mulle silma vaatasid viis tee mind sinu juurde ja su suudlust ootasin tärkas mu's lootus kuid mind ära tõukasid alla kuristikku suurde kuid vaid lendu tõusin siis ja lendan su juurde ma ikka tagasi.	et
2012	11	267	Triin Niitoja & John4	Hõbedased tiivad 	lyrics-triin_niitoja-hobedased_tiivad	1	Minu käes on music magazine aastast 85 need vanad superstaarid legendideks on saand unistada siiski võin et helesinine ekraan avastab mind enne kui kord vanaks saan meie aeg on see meie teed on need kui mõistad elu vaadata siis rohkem värve näed üle kauguste üle linnutee meid muusika viib lendama veel kõrgemele maast On täna saabumas öö mis tähed taevas süütab mine go go go nüüd võid lennata on pilvedel siin hõbedased tiivad what a wonderful life võiksin öelda ma üle helikõrguste täna öösel rändame kõik uus meid ootamas on ees las me verre täna voolata bassid , kõrged helid ka muusikaga kõike elus muuta saab uus maailm avaneb ja näed 3 head võimalust su käes haara nendest kinni kui saabub õige päev meie aeg on see meie teed on need kui mõitad elu vaadata siis rohkem värve näed üle kauguste üle linnutee meid muusika viib lendama veel kõrgemale maast 2x On täna saabumas öö mis tähed taevas süütab mine go go go nüüd võid lennata on pilvedel siin hõbedased tiivad what a wonderful life võiksin öelda ma üle helikõrguste täna öösel rändame kõik uus meid ootamas on ees	et
2012	12	262	Shanon	Libahunt 	lyrics-shanon-libahunt	1	mul on neli kihva armastan ja vihkan kõike ühekorraga mingi valu sunnib pärast kesköötundi mind su poole liipama on mustad mastid jäänud kaardilauale ma tean et täna öösel saan sind endale KALLIS ÄRA PELGA VAATA MULLE SILMA ENNE KUI SIND VÕTAN MA KÕIK MUU KÄIGU PÕRGU ARMASTUS KÄIB VERE KAUDU MEID IGAVESEKS ÜHENDAB saatus mulle päitseid 24 / 7 proovib pähe siduda väljapääsu pole olen see kes olen teiseks muutuda ei saa.	et
2012	13	251	Tenfold Rabbit	Oblivion 	lyrics-tenfold_rabbit-oblivion	1	I remember her on the first row She was staring at me so sweetly I was sitting with my accordion So I didn’t think I was cool enough (x2) I’ve often wondered What could have been But now she’s gone To the Oblivion (x4) I’ve often wondered What could have been But now she’s gone To the Oblivion (x6) I’ve often wondered What could have been But now she’s gone To the Oblivion	en
2012	14	206	Koit Toome	Tagasi alguses 	lyrics-koit_toome-tagasi_alguses	1	Seda ma ei lootnud, sellest ma ei mõelnud, mis võib siis juhtuda. Kui üle mitme aasta sinuga taas kohtun, millest peaksin rääkima. Olime ju noored, mässumeelsed hinged ja need sõnad tookord siis. Ütlemata jäid, meid siiamaani saatnud, et me öelda võiks veel neid. Ref: Ma tunnen kõike seda uuesti leian ennast olles siin näib taas nii tuttav see. Kui ukse avaksin ma enda ees hetkes milles nüüdki veel milles nüüdki veel.. Olen tagasi alguses Olen tagasi... Olen tagasi... alguses. Usu olen proovin'd tundetuna olla ja lasta kõigel minna nii. Külmavereliselt öelda iialgi ei suudaks et sa polnud tähtiski. Kui me poleks kaotanud iialgi ei suudaks tunda rõõmu võitudest. Meil mõlemil on siiski natukene aega mõelda teineteisele. Ref: Ma tunnen kõike seda uuesti leian ennast olles siin näib taas nii tuttav see. Kui ukse avaksin ma enda ees hetkes milles nüüdki veel milles nüüdki veel.. Olen tagasi alguses Olen tagasi... Olen tagasi... alguses. See maailm, milles tookord siis. Sinu pärast kõigest loobusin. On muutnud mindki, näed. Ref: Ma tunnen kõike seda uuesti leian ennast olles siin näib taas nii tuttav see. Kui ukse avaksin ma enda ees hetkes milles nüüdki veel milles nüüdki veel.. Olen tagasi alguses Olen tagasi... Olen tagasi... Kui ukse avaksin ma enda ees hetkes milles nüüdki veel milles nüüdki veel olen tagasi alguses.	et
