year	rank	votes	artist	song	filename	source	lyrics	language
2006	16	446	Vanilla Ninja	Dangerzone 	lyrics-vanilla_ninja-dangerzone	1	Lock me up in chains Want to be with me Think you know the score Feel my burning flames Wanna hold me tight Wanna be adored Feel my curse Welcome to the dangerzone Feel the poison in my veins Tell me are you strong enough To keep up with my life Welcome to the dangerzone What you see ain't what you get Let us fly this aeroplane Tonight Did you see the sign Did you read the warning in my eyes Got a heavy load Gotta stay on track when things explode And together we'll go through the fire Will you stay by my side? Welcome to the dangerzone Feel the poison in my veins Tell me are you strong enough To keep up with my life Welcome to the dangerzone What you see ain't what you get Let us fly this aeroplane Tonight Come with me Feel the need Youre mine tonight I will win this fight Come with me Hold the key Of destiny Welcome to the dangerzone Feel the poison in my veins Tell me are you strong enough To keep up with my life Welcome to the danger zone What you see ain't what you get Let us fly this aeroplane Tonight	en
2006	17	441	Ines	Iseendale 	lyrics-ines-iseendale	1	Koos, vaid tahan olla igal pool. Ei viitsi seigelda ja joosta seal, kus tulemust ei tea. Pool jääb maha vedelema. Pool jääb kasutamata, kui kaod, siis pean taas iseseisvuma. Niimoodi pooleldi on hea. Niimoodi aega kinni ei pea. Ei suuda teineteiseta. Ometi tean. Kõik, mis sa teed, teed kõik endale. Su ees on miljon teed. Vaid mõtle iseendale. Aeg on teha järldusi. Aeg on teha mõttetusi. Aeg on seal, kus tagasi ei saa. Öö saab olulisemaks kui päev. Ei taha raisata sind. Näen, et sa võid libiseda käest. Sinuta pooleldi on hea. Sinuta aega kinni ei pea. Ei suuda teineteiseta. Ometi tean. Kõik, mis sa teed, teed kõik endale. Su ees on miljon teed. Vaid mõtle iseendale. Kõik, mis sa teed. Teed kõik endale. Su sees on vastused. Su enda küsimustele. Huuuuuuuuuuu - uuuuuuuuuh. Huuuuuuuuuuu - uuuuuuuuuh. Kõik, mis sa teed, teed kõik endale. Su ees on miljon teed. Vaid mõtle iseendale. Kõik, mis sa teed, teed kõik endale. Su sees on vastused. Mmmmmm... . Su enda küsimustele.	et
2006	18	434	Smilers	Üle Tumeda Vee 	lyrics-smilers-ule_tumeda_vee	1	Sa, sa oled kui tarantiino film Ma, ma olen kui kärbes liimipaberil Sa, sa oled mu jaoks kui muusika Ja sa, sa oled kui haigus mida põdema pean Annaks sinule kõike, kohe praegu ja siin Sa omad kummalist võimu mu üle Tegelikult tean ju miks see on nii. Üle tumeda vee läbi sumedate ööde mööda pimedat teed mind kisub sinu poole Näen sinu silmade tagant tormist merd Tean sa tahad mult kolme tilka verd Ma, ma olen küll blond kuid mitte naiiv Ja ma vean, ma vean kihla et naudid iga minutit Tean et minuga mängid, see teeb sinule head Ma sellest supist mis keetsin ise ennast välja aitama pean. Üle tumeda vee, läbi sumedate ööde, mööda pimedat teed, mind kisub sinu poole.	et
2006	19	413	Aides	Tik-Tak 	lyrics-aides-tik_tak	1	time now makes a tik-tak in life still no click-clack what later it brings back? lets talk about - all about child twitching on the floor feels ashamed for opinion having doubt in her faith wanna talk about? love hides form the trust all alone in the game thats the price of our shame lets talk about - all about praying on your knees and asking trying, lying, dieing, crying and asking you for tomorrow gunshot! using up the law curing the state whats the price of your rate lets talk about - all about hate now makes a tik-tak in brain still no click-clack what the fuck it brings back wanna talk about? - all about	en
2006	20	397	Agent M	Šokolaad 	lyrics-agent_m-_okolaad	1	Kas tunned kui hea on lebada diivani embuses kui kaugel on veedetud päev Küll vahel ei vea, ja tunned et peagi võid murduda Siis õnne vaid selgemalt näed No kuhu jooksed taas, teist elu sa ei saa Kui ei meeldi siin, võid ennast sa ju panna põlema See pole film, kus alati võita saab õiglane Ja oodatud rada kõik käib Siin kõigel on piir Ja jäledaks muutub ka okolaad kui suu on vaid magusat täis	et
2006	21	380	Ursula	Tiffer 	lyrics-ursula-tiffer	1	"4x Ma ei kuule sind, sa ei kuule mind. Kui sa tulid minu poole seelikus ma tõmbasin sulle bemariga kõrvale ja pildusin: \""Beib, kenad jalad, kena top!\ Sa vastasid: \""Ää, mina vä?!\ Ma tajusin, see tshikk on oma jope ja ma mõtlesin, et öö seda kodus paneks, sa istusid minu musta unelmasse ja me tõmbasime Pirtale. 3x Ma ei kuule sind, sa ei kuule mind. Rannas, kus tüübid juba viinadega tõmban torso välja nahast särgist. Sa küsid: \""Mida mina nüüd siis teen?\ Ma vastan: \""Ole ilus.\ Kuum on, sa riietad end lahti, tuleb Ahti ja hakkab nilbusi pilduma, mõtlen: \""Klassikaline Ahti..\ Ja jooksen kikivarvul laintesse. 3x Ma ei kuule sind, sa ei kuule mind. Tõmbasime siis looduskaitsealale ja mõtlesin, et tiiki vaja on mu kalale. Jõudsime siis autoga metsa - KUI BENSIIN SAI OTSA. Lükkasime, lükkasime, lükkasime, lükkasime, lükkasime auto metsast välja otse tiiki, täiega triiki, tsikk oli vihane. Lihased lihased. 3x Ma ei kuule sind, sa ei kuule mind. Ütle Jaanus (Jaanus), ütle Albert (Albert) Ütle Jaanus Albert Destilleerivad."	et
2006	22	376	Dagö	Muusik 	lyrics-dago-muusik	1	Tere süütu suguühe ühest kaugest ajast Terje...Malle...Maire...sa vist ei öelnd'ki nime Ma seesama Toomas, kes su juurde roomas naine...koomas...kaine...no pole oluline Enne restorani lavalt silmis läige kaval a-moll...f-duur...jutt loll...tervitus nimeline see kes laulab söögiks, hiljem ühiskoogis sulle...ainult...hullem...romansi imemine Õues kohisevad puud sulle tere hommikut sa ei suudelnudki kuud hoopis mingit muusikut värvi koorub vannitoas baaripukist lilla kints august alla kraanijoas voolas lootus leida prints Meil on sama maitse, pole sinu maitse mina...ja ka...sina...ei ole taevaline vahel linnas näeme, vestlemagi jääme teemad...jõnkse...teevad, ja naer on vaevaline Õues kohisevad puud sulle tere hommikut sa ei suudelnudki kuud hoopis mingit muusikut värvi koorub vannitoas baaripukist lilla kints august alla kraanijoas voolas lootus leida prints Sa ei olnud mingi bitch lihtsalt mina olin lits Õues kohisevad puud sulle tere hommikut sa ei suudelnudki kuud hoopis mingit muusikut värvi koorub vannitoas baaripukist lilla kints august alla kraanijoas voolas lootus leida prints	et
2006	23	333	Tanel Padar & The Sun	Kuu On Päike 	lyrics-the_sun-kuu_on_paike	1	tunduda võib veider seisev kellaseier sina töötad, tema tööd ei tee aga kogu kaader ikkest lahti saades tiksuma edasi läeb, ei kustu veel alati ikka peale tööd koju ei läe, ei risti ette löö aeg alles algab ju! elada vaid, et käia tööl töötada või, et lahti saab lasta vöö valguses valge kuu vahel mulle näikse kuu on õige päike päeval tõsta silmi töölt ei saa isegi võib väita alles öösel käima lähen, alles koidul uinun ma alati ikka peale tööd koju ei läe, ei risti ette löö aeg alles algab ju! elada vaid, et käia tööl töötada või, et lahti saab lasta vöö valguses valge kuu mida sa päeval näed? unenägu on töö su käes hämaraks rokiks sul ju peas on suu! alati ikka peale tööd koju ei läe, ei risti ette löö aeg alles algab ju! elada vaid, et käia tööl töötada või, et lahti saab lasta vöö valguses valge kuu	et
2006	24	322	Maarja	Shine It On 	lyrics-maarja-shine_it_on	1	Just when you thought I was gone from afar I'm back like a shooting star, Couldn't see right from the wrong So I run and still the darkness calls Shine It on Shine a light on me, Shine it on electricity.. turn it on Like you're laser beam. Shine It on you're burying up my dreams Shine It on Come on and just shine it on! I was a shadow of you  innocent Fading just like a dawn Give it all that I had.. It was hell, untill my darkness fell! Shine It on Shine a light on me, Shine it on electricity.. turn it on Like you're laser beam. Shine It on you're burying up my dreams Shine it on Come on and just shine it on Do what you feel Turn back time cause you know your journey You shouldn't defend, just hit and run and you gone You blew them all away! Shine It on Shine a light on me, Shine it on electricity.. turn it on Like you're laser beam. Shine It on you're burying up my heart Shine it on.. come on and just shine it on Shine It on Shine a light on me, Shine it on electricity.. turn it on Like you're laser beam. Shine It on you're burying up my heart Shine it on.. come on and just shine it on!	en
2006	25	305	Kosmikud	Pulmad Ja Matused 	lyrics-kosmikud-pulmad_ja_matused	1	raskejalgne tütar kodus nurgavoodil ägiseb kiired pulmad tulekul, sest õpetus jäi andmata mõne kepilöögi järel libu võtnuks aru pähe läinud tütre au koos vurlest mehe laevaga pulmad ja matused pulmad ja matused pulmad, pulmad, matused oma paisvat põllealust ei kaua saand ta varjata nüüd ei aita nutt ei hala, kes siis käskis karata see vanamehest kapteniraisk on ju varsti mulla all kiired pulmad kiired lõpud  kaks korda ei ütelda!	et
2006	26	249	Terminaator	Superstaar 	lyrics-terminaator-superstaar	1	Meeleheitel kodukana avas kroonika Ei suutnud oma silmi uskuda Naabritüdruk sõitma oli läinud bussiga Nüüd kõigest sellest saame lugeda Ja kuulsuse koorem võib selja küll murda kuid vajavad kui õhku seda nad On Baari Paavo superstaar Bussi Pirjo superstaar Remondi Annika on superstaar Las ootab limu Voolab shampus Maitseb kaaviar sest elukutse on tal superstaar Piss off Lihtne Elu köidab meid sest see on huvitav Mida teevad Beibed kanalas? Pärast viivad poodi müügiks määrdund alukad See ongi tõsielu seebikas Ja varsti nad bändigi endale teevad siis ootab õhtulehe esikaas On Baari Paavo superstaar Veebi-Beebi superstaar Farmi Gabriel on superstaar Las ootab limu Voolab shampus Maitseb kaaviar sest Elukutse on neil superstaar Daamid ja Härrad Poisid ja tüdrukud Siit ta tuleb Uus... SUPERSTAAR On Baari Paavo superstaar Veebi-Beebi superstaar Farmi Gabriel on superstaar Las ootab limu Voolab shampus Maitseb kaaviar sest Elukutse on neil superstaaaaaaaar Super! UUh	et
2006	27	237	Elav Legend	Mälestused 	lyrics-elav_legend-malestused	1	On ju meeles mul see kui kohtusime ja silma mulle jäid kõik see veedetud aeg mis tookord nii lõputuna näis oli selge see et ükskord peab kõik ju lõppema ja ainsaks lohutuseks jäi see et võime kauges minevikus kohtuda Ref: mälestustest keegi meid välja ei saa ajada mälestustes võime kahekesi julgelt rännata mälestustele on loodud paik mis on nii puutumatu oled sina ja mina parandamatud kui sinna sisse kord saan ei enam kunagi ma taha leida tagasiteed ma tean,et kõrvetan kui siia kauaks jään ja otsin sinu pärlikeed nii aina palun su ees ärme iial jätame mälestuste laeva ja lase olla mul veel üks väike täht sinu unistuste taevas ref:2x	et
2006	28	235	Metsatöll	Lahinguväljal Näeme, Raisk! 	lyrics-metsatoll-lahinguvaljal_naeme_raisk_	1	Tuleme kui tuultepojad, võitleme kui verevennad. Raua rangust loitsvad tütred, külmast kanged kivikalmed. Täna lähme võitlemaie, läbi hiie, läbi laane. Rauda tules turjastama, verele ikestama! Lahinguväljal näeme, raisk! Soisest metsast on me maada rauast sündind randmeida. Susist sündind meele'eida, kivist sündind südameida. Lähme täna võitlemaie, läbi hiie, läbi laane. Rauda tules turjastama, verele ikestama! Lahinguväljal näeme, raisk! Loitma löönd me terasetuli, terast mis hangund me hinge, Sääl kokku metsavihased, põhjatuulte pojad ja tütred! Lähvad täna võitlemaie, läbi hiite, läbi laante, raudu tulle turjastama, verele ikestama! Lahinguväljal näeme, raisk!	et
2006	29	214	Tanel Padar & The Sun	Milles On Asi? 	lyrics-the_sun-milles_on_asi	1	Vara valge tund jälle segab õnnist und päike sülgab tuld pikki viimset sula lund seal kust must on muld tärkab punga järel pung miski sala sund sajanditest seatud tung on ka minul sees mul on kevad südames hoia kinni mees kõik on ees Ref: ole see kes oled naine sa või mees oma meelte lummas sipled nigunii asi pole suves, talves, kevades asi see on maitses lõpuks ikkagi vala välja pool see kui kevad vette vool see kui elu kool minu tsivilisatsioon lärmab linnu koor kõik on jälle hõrk ja noor iga nahapoor ja mu kuumav ajukoor teab et maitse meel minu muudgi tajud veel kõik on õigel teel lahe see Ref: ole see kes oled naine sa või mees oma meelte lummas sipled nigunii asi pole suves, talves, kevades asi see on maitses lõpuks ikkagi kevad südames meil on suured asjad ees ole võidu mees, taaskord õllele Ref:2x ole see kes oled naine sa või mees oma meelte lummas sipled nigunii asi pole suves, talves, kevades asi see on maitses lõpuks ikkagi	et
2006	30	211	Blacky	Ingel 	lyrics-blacky-ingel	1	Kõrgel pilvedes kord lendas ingel enda teed ja see tee, tõi ta mere kohale, kauni poisi eest leidis ingel rannavees ja ta sealt hakkas nõiduma ta meelt, ta sõlmis kaelakee ja keeras laineid vees, poiss põgenes eest ja nende vahele, kui oli jäänud veel paar sammu mereveest, tuul kaldale viis neid lainte vahu seest. Leidis enda sealt, kaunis ingel paitas pead ja maises vees said puhtamaks kõik vead, see tundus nõnda hea ja nii ingel kaotas pea ja maalis liiva, ammu tuntud read. Tuul kandis pilvedes ja soola merevees, paitades vastarmunutel pead, sai maailm ümber veest ja ingel tunda meest ja endale armsa maise peal.	et
2006	31	199	Tanel Padar & The Sun	Tahan Elada 	lyrics-tanel_padar-tahan_elada	1	Istun üksinda siin, tahan sul rääkida... Akna taga kuusõõr, kell on vaevalt pool viis. Ehk tead, et uinuda ei saa ma ju sageli ja pean valvama... Laulab väljas vaid tuul, akna taga kuusõõr. Ma pean, ent raske rääkida tormist minu sees, mil ümber kõik on vait mu sees. REF: Tahan elada, vabaks kiskuda, aga ma ei saa, olen väsinud. Tahan elada, jälle armuda, aga ma ei saa, olen loobunud... Veel veini üks klaas, õues kassikoraal. Peagi ärkamas linn, käsi väriseb mul. Sa tead, et olid sõber hea, ent torm on minu sees ja ümber kõik on vait, ma pean Tahan elada, vabaks kiskuda, aga ma ei saa, olen väsinud. Tahan elada, jälle armuda, aga ma ei saa, olen loobunud... Ainus milleks mul on jõudu, saata sulle veel need read. Ainus mida soovin öelda - tahan elada! Tahan elada, vabaks kiskuda, armust joobuda, valust karjuda! Tahan elada, vabaks kiskuda, aga ma ei saa, olen väsinud... Tahan elada, jälle armuda, aga ma ei saa, olen loobunud... Tahan elada, vabaks kiskuda, armust joobuda, valust karjuda! Tahan elada, vabaks kiskuda, armust joobuda ja valust karjuda!	et
2006	32	193	Terminaator	Nagu Esimene Kord 	lyrics-terminaator-nagu_esimene_kord	1	Arvasin et minuga seda juhtuda ei saa Liiga palju näinud elu teel Nagu 17 ma taas põlvest nõrk ja silmad maas Anusin et suudleksid mind veel Õlale kallutatud pea Silmad on kinni ja sa tea Tagasiteed ei ole siit Ref: Nagu esimene kord Kui hinges möllab torm Maagiline jõud Rebib mind su poole Nagu esimene kord Kui hinges möllab torm Ja aru ma ei saa Kuidas lasin kõigel sellel juhtuda. Halb on aimdus minu sees Ainus mis mind ootab ees On kokkupõrge iseendaga Isu kadunud on mul Uinun alles koidikul Kuigi peaksin kohe ärkama Südant ei või ju sundida Hinge ei tohi keelata Tagasi teed ei ole siit ref3x	et
2006	33	192	Soul Militia	Tule Kui Leebe Tuul 	lyrics-soul_militia-tule_kui_leebe_tuul	1	Tule kui leebe tuul tule minuga mu kevad suur tule kui tuli ja sära mu teel ole tulekuma kaugel ees lendan sinu järel üle maa ja vee Saada mind varjuna teel kaitse müürina mu habrast meelt tule kui tuli ja sära mu teel ole tulekuma kaugel ees lendan sinu järel üle maa ja vee Siis, kui lootus kaob ja klaasiks tardumas aeg siis mu leevendajaks saama peab su naer mind ravitse mind hoia sa ole valgus teel soe suvetuul mu kõrval oo... mind hoia sa oo... mind hoia nüüd oo... mind hoia sa Tule kui leebe tuul tule minuga mu kevad suur tule kui tuli ja sära mu teel ole tulekuma kaugel ees lendan sinu järel üle maa ja vee lendan sinu järel üle maa ja vee lendan sinu järel üle maa ja vee Tule kui tuul leebe tuul (4x)	et
2006	34	187	Def Räädu	Mis Värk On? 	lyrics-def_raadu-mis_vark_on	1	Mis värk on, ma küsin, mis värk on? Ma vaatan ringi, tahan teada, mis tegelt on! Kui mitme naise rinnas peidab ennast silikon? See, mis näha pakutakse, on vaid illusioon! Mis värk on, ma küsin, mis värk on? Sama küsimus - olgu dub või reggaeton! Mitme naeratuse taga'n tegelt pretensioon? Pentagon! õelge mulle, mis siis tegelt on! Klubi taganurgas paks prillidega poiss tõmbab suitsu, vaatab suurte rindadega naist. Kaks nädalat tagasi sai kaheksateist, isa on komissar politseis. Ema teab, et poeg õpib Tartu Ülikoolis fi-fi-fi-fi-filosoofia õppetoolis. Poeg aga elult midagi muud soovis, täna juba kolme erinevat narkootikumi proovis! Mis värk on, ma küsin, mis värk on? Vaatan ringi, tahaks teada, mis tegelt on! Kuidas hommikuti välja näeb Paris Hilton? See, mida näha pakutakse, on vaid illusioon! Mis värk on, küsin, mis värk on? Infoliin, palun võtke vastu telefon! Postiljon, räägi välja, mis tegelt on! Elion! öelge mulle, mis siis tegelt on! Leti ääres on mees, nimi on Fred, valge ülikond seljas, kirju lips on ees. Just tutvunud ilusa tüdrukuga, talle mitmendat konjakit välja teeb. õhtu arenedes, tuju paranedes, aeg lendab-dab-dab-tantsides. Mehe pilk on kinni ta rindades, paneb ette jalutada mere ääres. Päiksetõus leiab noored suudeldes, Fredi käsi leiab seeliku alla tee. Sellel hetkel - milline üllatus see - kuradi lits! Tuleb välja, et see eit on hoopis MEES!!! Mis värk on, ma küsin, mis värk on? Vaatan ringi, tahan teada, mis siis tegelt on! Kui mitme naise rinnas peidab ennast silikon? See, mis näidatakse'n vaid optiline illusioon! Mis värk on, ma küsin, mis värk on? Sama küsimus - olgu dub või reggaeton! Kas naeratuse taga peitub pretensioon? Benetton! öelge mulle, mis siis tegelt on! Samal ajal klubis, Rodeo kuubis, tuleb segi peaga rääbis, liigub aegluubis. Kusagilt peldiku seina tagant kuulis kuidas J.O.C. mikrofoni taga ruulis! Ta küsib: mis värk on, kesse laulab seal? Kudamoodi, tal pole ju dreadlokke peas? Tüüpiline aps on manada endale ette stereotüüpseid kujutluspilte, mis on täiesti valed ... Mis värk on, ta küsib, mis värk on? Ta vaatab ringi, tahab teada, mis tegelt on? Ära pabista, see olen mina, see pole grammofon! See, mida arvad, on vaid illusioon. Mis värk on, ma küsin, mis värk on? Vaatan ringi, tahaks teada, mis tegelt on! Kuidas hommikuti valja näeb Paris Hilton? See, mida näha pakutakse on vaid illusioon! Mis värk on, ma küsin, mis värk on? Telekom! öelge, mis värk tegelt on? Mitme naise rinnas peidab ennast silikon? Elektron! Kuidas asjad tegelikult on? Mis värk on, küsin, mis värk on? Vaatan ringi, tahan teada, mis tegelt on! Kui mitme naeratuse taga peitub pretensioon ... Ma tahaks teada!!!	et
2006	35	185	Blacky	Segased Lood 	lyrics-blacky-segased_lood	1	Valgusest võetud. Suurest südamest antud. Kallimaks kantud ja tallele pandud. Hoolitsust andnud. Argimast hoitud. Vahel lõpmatuks peetud ja ainsamaks. Neetud! Kallis, sa kuula mu tunnete keelt! See on üks minu südame pool. Kuni sõidame liigkiirelt kardetud teel, teise poolega on segased lood. Kui sa vaid kuulaks mu salajast meelt, siis sa märkaks, et siin on üks kood. Mõnikord, käed raudus, kihvatab meel kuid minu süda on su südame poolt. Vihmale valla. Juba öö läbi kallab? Vaiki võiks olla. Tunnen esimest halla. Pisut uimane valust. Hullult rabatud jalust. Enam rohkem ei talu seda varjatud valu! Kallis, sa kuula mu tunnete keelt! See on üks minu südame pool. Kuni sõidame liigkiirelt kardetud teel, teise poolega on segased lood. Kui sa vaid kuulaks mu salajast meelt, siis sa märkaks, et siin on üks kood. Mõnikord, käed raudus, kihvatab meel kuid minu süda on su südame poolt. Kuni sa näed minu südame häält. Kuni sa näed, et südame käes on aina suuremad väed. Kuni sa näed minu südame häält. Kallis, kas näed? Kallis, see ongi minu südame hääl! Kallis, sa kuula...	et
2006	36	157	Terminaator	Head Ööd 	lyrics-terminaator-head_ood	1	Kell kolmveerand kolm und veel ei saa küünla ma süütan põlema sulle mõeldes taas ööliblikas mu aknale end surub kui oleks viimne lend mis tal ees nagu temagi ihkan minagi tule poole ja ei karda ma tiibu kõrvetada soovin sulle ma head ööd soovin sulle ma head ööd kus iganes viibid ka sa tunnen kuidas hetkeks tardud soovin sulle ma head ööd soovin sulle ma head ööd kus iganes viibid ka sa tean et püüad kinni selle sosina küünla kustutan nüüd nii pimedaks jääb ei värele enam tema leek sul minna lasen ööliblikas võib nii jätkata teed neid aknaid on veel kus tuli on kuid kas ta teab vahel pimedus palju valgem veel kui valgus vahel vaikimine sõnast võimsam soovin sulle ma head ööd soovin sulle ma head ööd kus iganes viibid ka sa tunnen kuidas hetkeks tardud soovin sulle ma head ööd soovin sulle ma head ööd kus iganes viibid ka sa tean et püüad kinni selle sosina	et
2006	37	155	Supernova	Mustas Vaikuses 	lyrics-supernova-mustas_vaikuses	1	Korraga mu juurde sa leidsid üles tee. Mida peaksin mõtlema? Ma näen vastust sinu silmades. Ja ma näen vastust sinu silmades. Sinu juurde kohvile öösel poolel teel. Mõtlen kas sa tead mis teed. Ma näen vastust sinu silmades. Ja ma näen vastust sinu silmades. Ref. Mustas vaikuses häbi tundma me ei pea. (see teeb vaid head) Sinu lummusest end välja vedada ei saa. Ma seda tean. Sisened nirvanasse vaikselt ohates. Kas on õige mida teen? Ma näen vastust sinu silmades. Ja ma näen vastust sinu silmades. Ref. Mustas vaikuses häbi tundma me ei pea. (see teeb vaid head) Sinu lummusest end välja vedada ei saa. Ma seda tean. Ref. Mustas vaikuses häbi tundma me ei pea. (see teeb vaid head) Sinu lummusest end välja vedada ei saa. Ma seda tean. Ma näen vastust sinu silmades.(6x)	et
2006	38	154	Liisi Koikson	Sinu Hääl 	lyrics-liisi_koikson-sinu_haal	1	Tervitan Sind, Kas kuuled, On seal hommik, Või on õhtused tuuled, Kuidas on ilmad kuumad, Meil siin sajab, Meil siin valmivad õunad. Sul mõttes soovin head, Veel jäänud mõned read, Ma võiksin käia kasvõi mööda vett, Miks nii raske sulle on öelda ,et..... Tervitan Sind, Kas kuuled, On seal hommik, Või on õhtused tuuled, Kuidas on ilmad kuumad, Meil siin sajab, Meil siin valmivad õunad. Sul mõttes soovin head, Veel jäänud mõned read, Ma võiksin käia kasvõi mööda vett, Miks nii raske sulle on öelda ,et..... Öelda, et sinust ma hoolin Kuidas su hääl, sinu hääl Mind nii õnnelikuks teeb...	et
2006	39	152	Elav Legend	Vana Rada 	lyrics-elav_legend-vana_rada	1	Olen kolnaud mitmel teel, Lootnud leida ma kohta seal, Olen palju otsind,näind,tundnud valu hinge peal, Mööda kruusa,asfaldit kulgevad kõik sünged teed. Kas on kusagil sooja valgust,mis süütaks südamed. Ref: Tabab meid siis sädelus,jalad kinni metsa teel, Sind tugevalt hoian ma,Jah on õige rada see.. Nüüd käime vana tuttavat rada,meie jaoks ei leidu muud teed. Me võiks ju kõõluda kalju serval kuid liialt pinget ei paku see. Vana rada iial ei lõpe vaid taevasse suundub see. Kus tantsida võime üksnes seal tähtede valguses. Tugev vihm ja tuule iil, Meid ei kõiguta siit paigalt veel, Seal suure tamme varjus kui üxteist embame... Tean,et saabub vaikus kord ka selle raja teel. Võtad kinni sa mu käest õnne pisarad silmadel...	et
2006	40	152	Ursula	Ehitaja 	lyrics-ursula-ehitaja	1	Ma tõusen hommikul vara Võimlen, kümblen Lähen tööle tunni varem, et kraana otsa ronida Kraana, kraana traktor, traktor Laulan, kui kaste tõstan Lennukiga möödub Hektor, talle tuledega vilgutan Tantsi ära oma valu! Tantsi ära oma valu! Tantsi ära oma valu! Tantsi ära oma valu! Jee! Pausi ajal tõttan alla Liuglen, lendlen Söön poistega saia Anneli teeb näole ilme maia Hiljem kraana sees teen seksi Anneli käib kraanas seinast seina Talle näkku ma ei laksi, sest kraana juhil moto on selge silm Tantsi ära oma valu! Tantsi ära oma valu! Tantsi ära oma valu! Tantsi ära oma valu! Tantsi ära oma valu! Tantsi ära oma Tantsi ära oma Tantsi ära oma valu! Tantsi ära oma valu! Tantsi ära oma valu! Tantsi ära oma valu! Tantsi ära oma valu! Tantsi ära oma valu! Tantsi ära oma valu! Tantsi ära oma valu! Tantsi ära oma valu! Tantsi ära oma valu!	et
2007	1	3898	Bedwetters	Dramatic Letter To Conscience 	""			
2007	2	1584	Birgit Õigemeel	Kas Tead Mida Tähendab 	lyrics-birgit_oigemeel-kas_tead_mida_tahendab	1	Laulda seda laulu, ainult sulle võin. Armastuse kaudu, kord sa tulla said. Lootus annab jõudu, hoida sulle neid. Sõnu selles laulus, hoida sulle vaid. Täna tahaksin teada. Täna tunda tahaks sind. Ref: Kas tead mida tähendab, üks armastus suur. Mu igatsus mäletab veel paljugi muud. Tuleb taas meie aeg, kurbusest silmades saab naer. Püüan unustada, tänulik on meel. Mäletab mu keha, sinu kehakeelt. Kombeks punastada, sul on endiselt. Kõik on kohe näha, kui me kohtume. Täna tahaksin teada. Täna tunda tahaks sind. Ref: Kui kunagi alla andma peaks, kas kunagi must võiks valgeks saada. Kui kunagi juhtuks, et ei vea, Vikerkaare värviliseks maalin siis me armastuse. Ref: Ref: Tuleb taas meie aeg, kurbusest silmades saab naer...	et
